-- phpMyAdmin SQL Dump
-- version 4.7.0
-- https://www.phpmyadmin.net/
--
-- Host: 127.0.0.1
-- Generation Time: Oct 30, 2018 at 06:14 AM
-- Server version: 10.1.22-MariaDB
-- PHP Version: 7.1.4

SET SQL_MODE = "NO_AUTO_VALUE_ON_ZERO";
SET AUTOCOMMIT = 0;
START TRANSACTION;
SET time_zone = "+00:00";


/*!40101 SET @OLD_CHARACTER_SET_CLIENT=@@CHARACTER_SET_CLIENT */;
/*!40101 SET @OLD_CHARACTER_SET_RESULTS=@@CHARACTER_SET_RESULTS */;
/*!40101 SET @OLD_COLLATION_CONNECTION=@@COLLATION_CONNECTION */;
/*!40101 SET NAMES utf8mb4 */;

--
-- Database: `realestate`
--

-- --------------------------------------------------------

--
-- Table structure for table `appl_interest_rate_tbl`
--

CREATE TABLE `appl_interest_rate_tbl` (
  `id` int(11) NOT NULL,
  `appl_id` int(11) NOT NULL,
  `rate` decimal(10,2) NOT NULL
) ENGINE=InnoDB DEFAULT CHARSET=latin1;

--
-- Dumping data for table `appl_interest_rate_tbl`
--

INSERT INTO `appl_interest_rate_tbl` (`id`, `appl_id`, `rate`) VALUES
(74, 184, '424.00'),
(75, 185, '0.19'),
(76, 186, '0.03'),
(77, 187, '0.03'),
(78, 188, '0.12'),
(79, 188, '0.12'),
(80, 188, '0.12'),
(81, 188, '2.00'),
(82, 189, '0.32'),
(83, 190, '0.03'),
(84, 191, '12.00'),
(85, 192, '0.12'),
(86, 194, '12.00'),
(87, 195, '12.00'),
(88, 196, '14.00'),
(91, 197, '13.00'),
(92, 198, '0.11'),
(93, 199, '0.12'),
(94, 200, '0.11'),
(95, 201, '12.00'),
(96, 202, '0.11'),
(97, 203, '12.00'),
(98, 204, '0.11'),
(99, 205, '0.12'),
(100, 206, '0.12'),
(101, 207, '12.00'),
(102, 208, '12.00'),
(103, 219, '2.12'),
(104, 217, '7.80'),
(105, 220, '6.50'),
(106, 222, '5.20'),
(107, 225, '12.00'),
(108, 226, '0.12'),
(109, 227, '12.00'),
(110, 231, '8.90'),
(111, 229, '1.20'),
(112, 232, '5.60'),
(113, 234, '1.20'),
(114, 235, '1.20'),
(115, 236, '1.30'),
(116, 237, '1.20'),
(117, 239, '0.22'),
(118, 240, '1.20'),
(119, 242, '12.00'),
(120, 243, '12.00'),
(121, 244, '1.20'),
(122, 245, '1.20'),
(123, 247, '4.00'),
(124, 249, '1.20'),
(125, 250, '0.20'),
(126, 251, '45.00'),
(127, 252, '12.00'),
(128, 253, '12.00'),
(129, 254, '2.00'),
(130, 255, '1.20'),
(131, 256, '1.20'),
(132, 257, '1.20'),
(133, 258, '1.20'),
(134, 259, '1.20'),
(135, 260, '1.20'),
(136, 261, '1.20'),
(137, 260, '1.00'),
(138, 260, '0.23'),
(139, 263, '0.50'),
(140, 264, '1.20'),
(141, 265, '1.20'),
(142, 266, '2.20'),
(143, 267, '1.20'),
(144, 268, '1.20'),
(145, 269, '6.00'),
(146, 270, '1.20');

-- --------------------------------------------------------

--
-- Table structure for table `authz_tbl`
--

CREATE TABLE `authz_tbl` (
  `id` int(11) NOT NULL,
  `role` varchar(45) COLLATE utf8_unicode_ci NOT NULL,
  `authz_views` text COLLATE utf8_unicode_ci NOT NULL
) ENGINE=InnoDB DEFAULT CHARSET=utf8 COLLATE=utf8_unicode_ci;

--
-- Dumping data for table `authz_tbl`
--

INSERT INTO `authz_tbl` (`id`, `role`, `authz_views`) VALUES
(1, 'SALES', 'Allotment_letter_search,Application,Cost_calculation_search,Payment,Payment_previous,Payment_second,Payment_stages,View_application,about,agreement_royale_plot,all_paymentreceipt,allotment_letter,allotment_letter_duplex,allotment_letter_flat,allotment_letter_plot,allotment_letter_shop,appl_bank,application_search,calculation,copyright_notice,cost_calculation_for_duplex,cost_calculation_for_flat,cost_calculation_for_plot,cost_calculation_for_row_house,cost_calculation_for_shop,create_receipt,demand_letter,direct_receipt,direct_receipt_print,documentUpload2,err404,forgot,forgot_delete,home,index.html,invoice,license_agreement,locate_appl_payment,locate_applicant_agreement,locate_applicant_bank,locate_applicant_demandletter,locate_applicant_doc,locate_applicant_interest,locate_applicant_payment,login,logout,payment_receiptprint,payment_reg_input,pre_dash,profile,register,renew_license,reset_password,sales_welcome,search_demand_letter,sheet_one,showpayment,test_application,test_cost,unauthorized,update_application,update_bank,update_profile,view_agreement_letter,view_applicant_doc,view_applicant_interest,view_applicant_invoice,view_applicant_pay,view_applicant_stage_dl,view_bank,view_invoice,view_payment,payment_reg_input,demand_letter_all_stage,presales_welcome,work_completion,view_work_completion,final_calculation,locate_applicant_completion_search,locate_applicant_finalcal,final_calculation,final_calculation_update,final_calculation_view,documentUpload2,presales/Phase1_Shop,presales/Phase1_Shop_view,presales/Phase1_Duplex_Cost_Calculation,presales/Phase1_Duplex_Cost_Calculation_update,presales/Phase1_Duplex_Cost_Calculation_view,presales/Phase1_duplex_new_cost_calculation,presales/Phase1_flat,'),
(3, 'PRESALES', 'Allotment_letter_search,Application,Cost_calculation_search,Payment,Payment_previous,Payment_second,Payment_stages,View_application,about,agreement_royale_plot,all_paymentreceipt,allotment_letter,allotment_letter_duplex,allotment_letter_flat,allotment_letter_plot,allotment_letter_shop,appl_bank,application_search,calculation,copyright_notice,cost_calculation_for_duplex,cost_calculation_for_flat,cost_calculation_for_plot,cost_calculation_for_row_house,cost_calculation_for_shop,create_receipt,demand_letter,direct_receipt,direct_receipt_print,documentUpload2,err404,forgot,forgot_delete,home,index.html,invoice,license_agreement,locate_appl_payment,locate_applicant_agreement,locate_applicant_bank,locate_applicant_demandletter,locate_applicant_doc,locate_applicant_interest,locate_applicant_payment,login,logout,payment_receiptprint,payment_reg_input,pre_dash,profile,register,renew_license,reset_password,sales_welcome,search_demand_letter,sheet_one,showpayment,test_application,test_cost,unauthorized,update_application,update_bank,update_profile,view_agreement_letter,view_applicant_doc,view_applicant_interest,view_applicant_invoice,view_applicant_pay,view_applicant_stage_dl,view_bank,view_invoice,view_payment,payment_reg_input,demand_letter_all_stage,presales_welcome,work_completion,view_work_completion,final_calculation,locate_applicant_completion_search,locate_applicant_finalcal,final_calculation,final_calculation_update,final_calculation_view,documentUpload2,presales/Phase1_Shop,presales/Phase1_Shop_view,presales/Phase1_Duplex_Cost_Calculation,presales/Phase1_Duplex_Cost_Calculation_update,presales/Phase1_Duplex_Cost_Calculation_view,presales/Phase1_duplex_new_cost_calculation,presales/Phase1_flat,'),
(5, 'MD', 'Allotment_letter_search,Application,Cost_calculation_search,Payment,Payment_previous,Payment_second,Payment_stages,View_application,about,agreement_royale_plot,all_paymentreceipt,allotment_letter,allotment_letter_duplex,allotment_letter_flat,allotment_letter_plot,allotment_letter_shop,appl_bank,application_search,calculation,copyright_notice,cost_calculation_for_duplex,cost_calculation_for_flat,cost_calculation_for_plot,cost_calculation_for_row_house,cost_calculation_for_shop,create_receipt,demand_letter,direct_receipt,direct_receipt_print,documentUpload2,err404,forgot,forgot_delete,home,index.html,invoice,license_agreement,locate_appl_payment,locate_applicant_agreement,locate_applicant_bank,locate_applicant_demandletter,locate_applicant_doc,locate_applicant_interest,locate_applicant_payment,login,logout,payment_receiptprint,pre_dash,profile,register,renew_license,reset_password,search_demand_letter,sheet_one,showpayment,site_report,test_application,test_cost,unauthorized,update_application,update_bank,update_profile,view_agreement_letter,view_applicant_doc,view_applicant_interest,view_applicant_invoice,view_applicant_pay,view_applicant_stage_dl,view_bank,view_invoice,view_payment,dashboard,presales/new_prospect,presales/plot_sheet1,presales/plot_update_sheet,presales/plot_view_sheet,presales/pre_sales_cost_calculation,presales/sheet1,presales/sheet1_other,presales/show_visitor,presales/update_sheet1,presales/view_sheet,sales_welcome,payment_reg_input,demand_letter_all_stage,presales_welcome,final_payment,work_completion,view_work_completion,final_calculation,locate_applicant_completion_search,locate_applicant_finalcal,final_calculation,final_calculation_update,final_calculation_view,documentUpload2,presales/Phase1_SHOP,presales/Phase1_Shop_view,presales/Phase1_Shop_update,presales/Phase1_Duplex_Cost_Calculation,presales/Phase1_Duplex_Cost_Calculation_update,presales/Phase1_Duplex_Cost_Calculation_view,presales/Phase1_duplex_new_cost_calculation,presales/Phase1_flat,'),
(6, 'ADMIN', 'Allotment_letter_search,Application,Cost_calculation_search,Payment,Payment_previous,Payment_second,Payment_stages,View_application,about,agreement_royale_plot,all_paymentreceipt,allotment_letter,allotment_letter_duplex,allotment_letter_flat,allotment_letter_plot,allotment_letter_shop,appl_bank,application_search,calculation,copyright_notice,cost_calculation_for_duplex,cost_calculation_for_flat,cost_calculation_for_plot,cost_calculation_for_row_house,cost_calculation_for_shop,create_receipt,demand_letter,direct_receipt,direct_receipt_print,documentUpload2,err404,forgot,forgot_delete,home,index.html,invoice,license_agreement,locate_appl_payment,locate_applicant_agreement,locate_applicant_bank,locate_applicant_demandletter,locate_applicant_doc,locate_applicant_interest,locate_applicant_payment,login,logout,payment_receiptprint,payment_reg_input,pre_dash,profile,register,renew_license,reset_password,sales_welcome,search_demand_letter,sheet_one,showpayment,site_report,test_application,test_cost,unauthorized,update_application,update_bank,update_profile,view_agreement_letter,view_applicant_doc,view_applicant_interest,view_applicant_invoice,view_applicant_pay,view_applicant_stage_dl,view_bank,view_invoice,view_payment,dashboard,presales/new_prospect,presales/plot_sheet1,presales/plot_update_sheet,presales/plot_view_sheet,presales/pre_sales_cost_calculation,presales/sheet1,presales/sheet1_other,presales/show_visitor,presales/update_sheet1,presales/view_sheet,payment_reg_input,demand_letter_all_stage,presales_welcome,locate_applicant_finalcal,final_calculation,final_calculation_update,final_calculation_view,EssarjeeSampada_Phase1_SHOP,presales/Phase1_duplex_new_cost_calculation,presales/Phase1_flat,'),
(7, 'SALES HEAD', 'Allotment_letter_search,Application,Cost_calculation_search,Payment,Payment_previous,Payment_second,Payment_stages,View_application,about,agreement_royale_plot,all_paymentreceipt,allotment_letter,allotment_letter_duplex,allotment_letter_flat,allotment_letter_plot,allotment_letter_shop,appl_bank,application_search,calculation,copyright_notice,cost_calculation_for_duplex,cost_calculation_for_flat,cost_calculation_for_plot,cost_calculation_for_row_house,cost_calculation_for_shop,create_receipt,demand_letter,direct_receipt,direct_receipt_print,documentUpload2,err404,forgot,forgot_delete,home,index.html,invoice,license_agreement,locate_appl_payment,locate_applicant_agreement,locate_applicant_bank,locate_applicant_demandletter,locate_applicant_doc,locate_applicant_interest,locate_applicant_payment,login,logout,payment_receiptprint,payment_reg_input,pre_dash,profile,register,renew_license,reset_password,sales_welcome,search_demand_letter,sheet_one,showpayment,test_application,test_cost,unauthorized,update_application,update_bank,update_profile,view_agreement_letter,view_applicant_doc,view_applicant_interest,view_applicant_invoice,view_applicant_pay,view_applicant_stage_dl,view_bank,view_invoice,view_payment,presales/new_prospect,presales/plot_sheet1,presales/plot_update_sheet,presales/plot_view_sheet,presales/pre_sales_cost_calculation,presales/sheet1,presales/sheet1_other,presales/show_visitor,presales/update_sheet1,presales/view_sheet,sales_welcome,payment_reg_input,demand_letter_all_stage,presales_welcome,locate_applicant_finalcal,final_calculation,final_calculation_update,final_calculation_view,presales/Phase1_Shop,presales/Phase1_Shop_view,presales/Phase1_flat,'),
(8, 'SITE MANAGER', 'site_report,err404,forgot,forgot_delete,home,index.html,login,logout,pre_dash,profile,unauthorized,locate_applicant_finalcal,final_calculation,final_calculation_update,final_calculation_view,');

-- --------------------------------------------------------

--
-- Table structure for table `bank_details_tbl`
--

CREATE TABLE `bank_details_tbl` (
  `applicant_id` int(11) NOT NULL,
  `id` int(11) NOT NULL,
  `bank_name` varchar(200) COLLATE utf8_unicode_ci NOT NULL,
  `bank_address` varchar(300) COLLATE utf8_unicode_ci NOT NULL,
  `bank_ifsc` varchar(20) COLLATE utf8_unicode_ci NOT NULL,
  `loan_amount_sanctioned` decimal(10,2) NOT NULL,
  `loan_file_number` varchar(30) COLLATE utf8_unicode_ci NOT NULL,
  `pc_loan_amount_sanctioned` decimal(10,2) NOT NULL,
  `status` varchar(40) COLLATE utf8_unicode_ci NOT NULL
) ENGINE=InnoDB DEFAULT CHARSET=utf8 COLLATE=utf8_unicode_ci;

--
-- Dumping data for table `bank_details_tbl`
--

INSERT INTO `bank_details_tbl` (`applicant_id`, `id`, `bank_name`, `bank_address`, `bank_ifsc`, `loan_amount_sanctioned`, `loan_file_number`, `pc_loan_amount_sanctioned`, `status`) VALUES
(82, 0, 'asdfas', 'fasasdf\r\n', 'afd2342', '34535.00', 'fsa234423', '0.98', ''),
(86, 0, 'sbi', 'bhopal', '89s9', '324242.00', 'sa898', '9.20', ''),
(173, 0, 'Bank Of Brodra', 'Rajkoat ', '001BOB', '2500000.00', '1020', '65.79', '');

-- --------------------------------------------------------

--
-- Table structure for table `before_possession_tbl`
--

CREATE TABLE `before_possession_tbl` (
  `id` int(11) NOT NULL,
  `appl_id` int(11) NOT NULL,
  `unit_no` varchar(45) COLLATE utf8_unicode_ci NOT NULL,
  `unit_cost1` decimal(10,2) DEFAULT NULL,
  `maintiance_charge` decimal(10,2) DEFAULT NULL,
  `monthly_operation` decimal(10,2) DEFAULT NULL,
  `society_common` decimal(10,2) DEFAULT NULL,
  `society_membership_charges` decimal(10,2) DEFAULT NULL,
  `registration_stamp` decimal(10,2) DEFAULT NULL,
  `service_tax1` decimal(10,2) DEFAULT NULL,
  `service_tax2` decimal(10,2) DEFAULT NULL,
  `service_tax3` decimal(10,2) DEFAULT NULL,
  `service_tax4` decimal(10,2) DEFAULT NULL,
  `service_tax5` decimal(10,2) DEFAULT NULL,
  `interest` decimal(10,2) DEFAULT NULL,
  `total` decimal(10,2) DEFAULT NULL,
  `payment_received` decimal(10,2) DEFAULT NULL,
  `due_balance` decimal(10,2) DEFAULT NULL
) ENGINE=InnoDB DEFAULT CHARSET=utf8 COLLATE=utf8_unicode_ci;

--
-- Dumping data for table `before_possession_tbl`
--

INSERT INTO `before_possession_tbl` (`id`, `appl_id`, `unit_no`, `unit_cost1`, `maintiance_charge`, `monthly_operation`, `society_common`, `society_membership_charges`, `registration_stamp`, `service_tax1`, `service_tax2`, `service_tax3`, `service_tax4`, `service_tax5`, `interest`, `total`, `payment_received`, `due_balance`) VALUES
(1, 150, 'H-197', NULL, NULL, '0.00', '452.00', NULL, '585.00', '0.00', '0.00', '12.00', '0.00', '0.00', '0.00', '2067649.00', '1925000.00', '142649.00'),
(4, 153, 'H-200', NULL, NULL, '0.00', '0.00', NULL, '0.00', '0.00', '200.00', '0.00', '0.00', '0.00', '0.00', '2266800.00', '2125000.00', '141800.00'),
(5, 173, 'H-30', NULL, NULL, '0.00', '0.00', NULL, '99.00', '0.00', '99.00', '77.00', '88.00', '55.00', '99999999.99', '99999999.99', '3800000.00', '99999999.99'),
(6, 174, 'H-58', NULL, NULL, '0.00', '0.00', NULL, '0.00', '0.00', '0.00', '0.00', '0.00', '0.00', '0.00', '3803000.00', '580000.00', '3223000.00'),
(8, 149, 'H-194', '3500000.00', '3000.00', '3000.00', '2000.00', '3000.00', '3000.00', '3000.00', '3000.00', '3000.00', '3000.00', '3000.00', '3000.00', '3532000.00', '2555000.00', '977000.00'),
(9, 151, 'H-6', '2500000.00', '111.00', '222.00', '333.00', '444.00', '555.00', '666.00', '777.00', '888.00', '999.00', '1100.00', '11110.00', '2517205.00', '2500000.00', '17205.00'),
(10, 163, 'H-7', '3500000.00', '45.00', '455.00', '54.00', '545.00', '55.00', '55.00', '55.00', '55.00', '55.00', '55.00', '55.00', '3501484.00', '3500000.00', '1484.00'),
(11, 235, 'H-233', '6000000.00', '10000.00', '1000.00', '1000.00', '1000.00', '1000.00', '1000.00', '1000.00', '1000.00', '1000.00', '1000.00', '15000.00', '6034000.00', '6000000.00', '34000.00'),
(12, 196, 'H-123', '3480000.00', '4500.00', '0.00', '0.00', '0.00', '0.00', '0.00', '0.00', '4500.00', '0.00', '0.00', '0.00', '3489000.00', '0.00', '0.00'),
(13, 218, 'shop-10', '202000.00', '0.00', '0.00', '0.00', '0.00', '0.00', '0.00', '0.00', '78000.00', '80000.00', '0.00', '0.00', '360000.00', '0.00', '0.00'),
(14, 221, 'H-84', '3743619.33', '5000.00', '5000.00', '0.00', '0.00', '5000.00', '5000.00', '5000.00', '50000.00', '5000.00', '60000.00', '5000.00', '3888619.33', '0.00', '3888619.33'),
(15, 261, 'H-82', '2501116.00', '0.00', '0.00', '0.00', '0.00', '0.00', '0.00', '0.00', '0.00', '0.00', '0.00', '0.00', '2501116.00', '2501116.00', '0.00'),
(16, 264, 'H-235', '3815227.54', '0.00', '0.00', '0.00', '0.00', '0.00', '0.00', '0.00', '0.00', '0.00', '0.00', '0.00', '3815227.54', '1553806.88', '2261420.66'),
(17, 230, 'H-87', '3743619.33', '33.33', '33.33', '0.00', '0.00', '33.33', '33.33', '33.33', '33.33', '33.33', '33.00', '0.00', '3743885.64', '0.00', '0.00');

-- --------------------------------------------------------

--
-- Table structure for table `category_tbl`
--

CREATE TABLE `category_tbl` (
  `id` int(11) NOT NULL,
  `category_name` varchar(30) COLLATE utf8_unicode_ci NOT NULL,
  `unit_type` int(11) NOT NULL
) ENGINE=InnoDB DEFAULT CHARSET=utf8 COLLATE=utf8_unicode_ci;

--
-- Dumping data for table `category_tbl`
--

INSERT INTO `category_tbl` (`id`, `category_name`, `unit_type`) VALUES
(5, 'MIG', 11),
(6, 'HIG', 11),
(8, 'Area', 12),
(9, 'HIG', 15),
(11, 'Other', 11),
(12, 'EWS', 13),
(13, 'LIG', 13);

-- --------------------------------------------------------

--
-- Table structure for table `company_info_tbl`
--

CREATE TABLE `company_info_tbl` (
  `id` int(11) NOT NULL,
  `attribute` varchar(45) NOT NULL,
  `value` varchar(150) NOT NULL
) ENGINE=InnoDB DEFAULT CHARSET=latin1;

--
-- Dumping data for table `company_info_tbl`
--

INSERT INTO `company_info_tbl` (`id`, `attribute`, `value`) VALUES
(1, 'Company Name', 'Essarjee Constructions Private Limited '),
(2, 'Address', 'Essarjee House, Z-10, Zone-I, Mezzanine Floor, M.P. Nagar, Bhopal'),
(3, 'GSTIN', '23AAACE8852F1ZS'),
(4, 'CIN', 'U7010MP1996PTC010648'),
(5, 'E-Mail', 'essarjee@gmail.com'),
(6, 'Pin-code', '462030'),
(7, 'RERA Regd No.', 'P-BPL-17-445'),
(8, 'PAN', '789456321'),
(9, ' TIN', '01235454'),
(10, 'Bank Name', 'Allahbad Bank '),
(11, 'Account Number', '50000847363'),
(12, 'IFS Code', 'ALLA0210197'),
(13, 'DL_Payment_Period', '15'),
(14, 'late_interest_rate', '0.11'),
(15, 'Completion Certificate', '1456456465'),
(16, 'Aadhar', '123456789123'),
(17, 'ACCOUNT_SECTION', 'rwamailer@gmail.com'),
(18, 'SITE ENGINEER', 'Arjun Shukhla,Manoj Verma,Rajesh Mishra'),
(19, 'MD_email', 'nmalviya575@gmail.com');

-- --------------------------------------------------------

--
-- Table structure for table `completion_of_work`
--

CREATE TABLE `completion_of_work` (
  `id` int(11) NOT NULL,
  `applicant_id` int(11) NOT NULL,
  `project_id` int(11) NOT NULL,
  `phase` varchar(40) COLLATE utf8_unicode_ci NOT NULL,
  `type` varchar(50) COLLATE utf8_unicode_ci NOT NULL,
  `block` varchar(40) COLLATE utf8_unicode_ci NOT NULL,
  `unit_no` varchar(20) COLLATE utf8_unicode_ci NOT NULL,
  `drawing_room` varchar(80) COLLATE utf8_unicode_ci DEFAULT NULL,
  `dining_room` varchar(80) COLLATE utf8_unicode_ci DEFAULT NULL,
  `bedroom_1` varchar(80) COLLATE utf8_unicode_ci DEFAULT NULL,
  `bedroom_2` varchar(80) COLLATE utf8_unicode_ci DEFAULT NULL,
  `bedroom_3` varchar(80) COLLATE utf8_unicode_ci DEFAULT NULL,
  `kitchen` varchar(80) COLLATE utf8_unicode_ci DEFAULT NULL,
  `staircase` varchar(80) COLLATE utf8_unicode_ci DEFAULT NULL,
  `lobby_area` varchar(80) COLLATE utf8_unicode_ci DEFAULT NULL,
  `front_terrace` varchar(80) COLLATE utf8_unicode_ci DEFAULT NULL,
  `back_terrace` varchar(80) COLLATE utf8_unicode_ci DEFAULT NULL,
  `toilet_floor` varchar(80) COLLATE utf8_unicode_ci DEFAULT NULL,
  `toilet_wall` varchar(80) COLLATE utf8_unicode_ci DEFAULT NULL,
  `kitchen_wall_tiles` varchar(80) COLLATE utf8_unicode_ci DEFAULT NULL,
  `wash_area` varchar(80) COLLATE utf8_unicode_ci DEFAULT NULL,
  `tpn` int(11) DEFAULT NULL,
  `porch` varchar(80) COLLATE utf8_unicode_ci DEFAULT NULL,
  `flush_door` varchar(80) COLLATE utf8_unicode_ci DEFAULT NULL,
  `dewas_frame` varchar(80) COLLATE utf8_unicode_ci DEFAULT NULL,
  `alluminium_handle` varchar(80) COLLATE utf8_unicode_ci DEFAULT NULL,
  `aldrops` varchar(80) COLLATE utf8_unicode_ci DEFAULT NULL,
  `door_stopper` varchar(80) COLLATE utf8_unicode_ci DEFAULT NULL,
  `tower_bolt` varchar(80) COLLATE utf8_unicode_ci DEFAULT NULL,
  `window_alluminium` varchar(80) COLLATE utf8_unicode_ci DEFAULT NULL,
  `window_ventilator` varchar(80) COLLATE utf8_unicode_ci DEFAULT NULL,
  `san_indian` int(50) DEFAULT NULL,
  `san_european` int(50) DEFAULT NULL,
  `san_seat_cover` int(50) DEFAULT NULL,
  `san_bib_cock` int(50) DEFAULT NULL,
  `san_pillar_cock` int(50) DEFAULT NULL,
  `san_wall_mix` int(50) DEFAULT NULL,
  `san_c_p_stop_cocks` int(50) DEFAULT NULL,
  `san_cpn` int(50) DEFAULT NULL,
  `san_wash_basin` int(50) DEFAULT NULL,
  `san_waste_pipe` int(50) DEFAULT NULL,
  `elec_6_amp_switch` int(50) DEFAULT NULL,
  `elec_16_amp_switch` int(50) DEFAULT NULL,
  `elec_6_amp_socket` int(50) DEFAULT NULL,
  `elec_16_amp_socket` int(50) DEFAULT NULL,
  `elec_ceiling_rose` int(50) DEFAULT NULL,
  `elec_angle_holder` int(50) DEFAULT NULL,
  `elec_button_holder` int(50) DEFAULT NULL,
  `elec_mcb` int(50) DEFAULT NULL,
  `work_completion_date` date DEFAULT NULL
) ENGINE=InnoDB DEFAULT CHARSET=utf8 COLLATE=utf8_unicode_ci;

--
-- Dumping data for table `completion_of_work`
--

INSERT INTO `completion_of_work` (`id`, `applicant_id`, `project_id`, `phase`, `type`, `block`, `unit_no`, `drawing_room`, `dining_room`, `bedroom_1`, `bedroom_2`, `bedroom_3`, `kitchen`, `staircase`, `lobby_area`, `front_terrace`, `back_terrace`, `toilet_floor`, `toilet_wall`, `kitchen_wall_tiles`, `wash_area`, `tpn`, `porch`, `flush_door`, `dewas_frame`, `alluminium_handle`, `aldrops`, `door_stopper`, `tower_bolt`, `window_alluminium`, `window_ventilator`, `san_indian`, `san_european`, `san_seat_cover`, `san_bib_cock`, `san_pillar_cock`, `san_wall_mix`, `san_c_p_stop_cocks`, `san_cpn`, `san_wash_basin`, `san_waste_pipe`, `elec_6_amp_switch`, `elec_16_amp_switch`, `elec_6_amp_socket`, `elec_16_amp_socket`, `elec_ceiling_rose`, `elec_angle_holder`, `elec_button_holder`, `elec_mcb`, `work_completion_date`) VALUES
(1, 104, 1, 'Phase-2', 'Duplex', 'HIG', 'G-27', '12 fan', '12 fan', '12 fan', '12 fan', '12 fan', '12 fan', '12 fan', '12 fan', '12 fan', '12 fan', '12 fan', 'dasfasdfsad', 'fdsafsad', 'fdsfsa', NULL, 'tttttttt', '12 fan', '12 fan', '12 fan', '12 fan', '12 fan', '', '', '', 56, 56, 56, 56, 56, 0, 9897, 987987, 89, 98, 76, 7, 7, 7, 7, 7, 7, 7, '2018-01-24'),
(2, 142, 1, 'Phase-2', 'Duplex', 'HIG', 'G-24', '45', '85', '', '', '', '', '', '', '', '', '', '', '', '', NULL, NULL, '', '', '', '', '', '', '', '', 0, 0, 0, 0, 0, 0, 0, 0, 0, 0, 0, 0, 0, 0, 0, 0, 0, 0, '2018-01-30'),
(3, 177, 1, 'Phase-2', 'Duplex', 'HIG', 'H-41', 'text', 'text', 'text', 'text', 'text', 'text', 'text', 'text', 'text', 'text', 'text', 'text', 'text', 'text', NULL, 'text 123', 'text', 'text', 'text', 'text', 'text', 'text', 'text', 'text', 1, 1, 1, 1, 11, 1, 1, 1, 1, 1, 1, 1, 1, 1, 1, 1, 1, 1, '2018-02-13'),
(4, 151, 1, 'Phase-2', 'Duplex', 'HIG', 'H-6', '3', '3', '3', '3', '3', '3', '3', '3', '3', '4', '4', '4', '7', '5', 5, '4', '44', '7', '7', '5', '5', '4', '7', '7', 5, 5, 5, 5, 5, 7, 5, 5, 5, 5, 7, 5, 4, 4, 7, 7, 7, 7, '2018-02-17'),
(5, 163, 1, 'Phase-2', 'Duplex', 'HIG', 'H-7', 'fasdf', '', '', '', '', '', '', '', '', '', '', '', '', '', 0, '', '', '', '', '', '', '', '', '', 0, 0, 0, 0, 0, 0, 0, 0, 0, 0, 0, 0, 0, 0, 0, 0, 0, 0, '2018-02-17'),
(6, 235, 1, 'Phase-2', 'Duplex', 'HIG', 'H-233', '1', '1', '1', '1', '1', '1', '1', '1', '1', '1', '1', '1', '1', '1', 4, '2', '4', '2', '1', '1', '1', '1', '1', '2', 4, 4, 1, 2, 5, 3, 5, 5, 5, 4, 6, 25, 14, 2, 1, 1, 1, 4, '2018-03-09');

-- --------------------------------------------------------

--
-- Table structure for table `co_applicant_tbl`
--

CREATE TABLE `co_applicant_tbl` (
  `id` int(11) NOT NULL,
  `first_appl_id` int(11) NOT NULL,
  `ca_mr_mrs` varchar(10) CHARACTER SET utf8 COLLATE utf8_unicode_ci DEFAULT NULL,
  `ca_name` varchar(50) CHARACTER SET utf8 COLLATE utf8_unicode_ci DEFAULT NULL,
  `ca_dob` varchar(45) CHARACTER SET utf8 COLLATE utf8_unicode_ci DEFAULT NULL,
  `ca_age` int(10) DEFAULT NULL,
  `co_present_add` varchar(255) CHARACTER SET utf8 COLLATE utf8_unicode_ci DEFAULT NULL,
  `co_parma_add` varchar(255) CHARACTER SET utf8 COLLATE utf8_unicode_ci DEFAULT NULL,
  `ca_pincode` varchar(20) CHARACTER SET utf8 COLLATE utf8_unicode_ci DEFAULT NULL,
  `ca_son_doughter_wife` varchar(30) CHARACTER SET utf8 COLLATE utf8_unicode_ci DEFAULT NULL,
  `ca_son_doughter_wife_mr_mrs` varchar(50) CHARACTER SET utf8 COLLATE utf8_unicode_ci DEFAULT NULL,
  `ca_swd_of` varchar(30) CHARACTER SET utf8 COLLATE utf8_unicode_ci DEFAULT NULL,
  `ca_aadhar_no` varchar(12) CHARACTER SET utf8 COLLATE utf8_unicode_ci DEFAULT NULL,
  `ca_mo_no` varchar(10) CHARACTER SET utf8 COLLATE utf8_unicode_ci DEFAULT NULL,
  `ca_landline_no` varchar(45) CHARACTER SET utf8 COLLATE utf8_unicode_ci DEFAULT NULL,
  `ca_email` varchar(50) CHARACTER SET utf8 COLLATE utf8_unicode_ci DEFAULT NULL,
  `ca_pan` varchar(20) CHARACTER SET utf8 COLLATE utf8_unicode_ci DEFAULT NULL,
  `ca_company_name` varchar(50) CHARACTER SET utf8 COLLATE utf8_unicode_ci DEFAULT NULL,
  `ca_doj` varchar(45) CHARACTER SET utf8 COLLATE utf8_unicode_ci DEFAULT NULL,
  `ca_desig` varchar(50) CHARACTER SET utf8 COLLATE utf8_unicode_ci DEFAULT NULL,
  `ca_department` varchar(50) CHARACTER SET utf8 COLLATE utf8_unicode_ci DEFAULT NULL,
  `ca_monthly_income` varchar(30) CHARACTER SET utf8 COLLATE utf8_unicode_ci DEFAULT NULL,
  `ca_Qualification` varchar(30) CHARACTER SET utf8 COLLATE utf8_unicode_ci DEFAULT NULL,
  `ca_occupation` varchar(50) CHARACTER SET utf8 COLLATE utf8_unicode_ci DEFAULT NULL,
  `ca_addr_of_employer` varchar(50) CHARACTER SET utf8 COLLATE utf8_unicode_ci DEFAULT NULL,
  `ca_addr_of_pincode` varchar(45) CHARACTER SET utf8 COLLATE utf8_unicode_ci DEFAULT NULL,
  `ca_bank_name_ac_no` int(20) DEFAULT NULL,
  `ca_img_path` varchar(150) CHARACTER SET utf8 COLLATE utf8_unicode_ci DEFAULT NULL
) ENGINE=InnoDB DEFAULT CHARSET=latin1;

--
-- Dumping data for table `co_applicant_tbl`
--

INSERT INTO `co_applicant_tbl` (`id`, `first_appl_id`, `ca_mr_mrs`, `ca_name`, `ca_dob`, `ca_age`, `co_present_add`, `co_parma_add`, `ca_pincode`, `ca_son_doughter_wife`, `ca_son_doughter_wife_mr_mrs`, `ca_swd_of`, `ca_aadhar_no`, `ca_mo_no`, `ca_landline_no`, `ca_email`, `ca_pan`, `ca_company_name`, `ca_doj`, `ca_desig`, `ca_department`, `ca_monthly_income`, `ca_Qualification`, `ca_occupation`, `ca_addr_of_employer`, `ca_addr_of_pincode`, `ca_bank_name_ac_no`, `ca_img_path`) VALUES
(1, 194, '', '', '', 0, '', '', '', '', '', '', '', '', NULL, '', '', '', '', '', '', '', '', NULL, '', '', NULL, './uploads/applicants_img/'),
(2, 195, '', '', '', 0, '', '', '', '', '', '', '', '', NULL, '', '', '', '', '', '', '', '', NULL, '', '', NULL, './uploads/applicants_img/'),
(3, 196, 'Mr.', 'Rahul Jha', '', 0, '', '', '', 'S/o.', 'Mr.', 'Rohan Jha', '', '', NULL, '', '', '', '', '', '', '0.00', '', '', '', '', NULL, './uploads/applicants_img/NAFISA2201802270405341519727734ESSARJEE SAMPADA.jpg'),
(4, 196, 'Mr.', 'Rahul Jha', '', 0, '', '', '', 'S/o.', 'Mr.', 'Rohan Jha', '', '', NULL, '', '', '', '', '', '', '0.00', '', '', '', '', NULL, './uploads/applicants_img/ramu7201802270408521519727932ESSARJEE SAMPADA.jpg'),
(5, 196, 'Mr.', 'Rahul Jha', '', 0, '', '', '', 'S/o.', 'Mr.', 'Rohan Jha', '', '', NULL, '', '', '', '', '', '', '0.00', '', '', '', '', NULL, './uploads/applicants_img/ramu7201802270411201519728080ESSARJEE SAMPADA.jpg'),
(6, 197, 'Mrs.', 'Aafreen Khan', '', 0, 'bhopal', 'bhopal', '', 'W/o.', 'Mr.', 'Iram Khan', '', '', NULL, '', '', '', '', '', '', '0.00', '', '', '', '', NULL, './uploads/applicants_img/NAFISA2201802270510211519731621ESSARJEE SAMPADA.jpg'),
(7, 198, '', '', '', 0, '', '', '', '', '', '', '', '', NULL, '', '', '', '', '', '', '', '', NULL, '', '', NULL, './uploads/applicants_img/'),
(8, 199, '', '', '', 0, '', '', '', '', '', '', '', '', NULL, '', '', '', '', '', '', '', '', NULL, '', '', NULL, './uploads/applicants_img/'),
(9, 200, '', '', '', 0, '', '', '', '', '', '', '', '', NULL, '', '', '', '', '', '', '', '', NULL, '', '', NULL, './uploads/applicants_img/'),
(10, 201, '', '', '', 0, '', '', '', '', '', '', '', '', NULL, '', '', '', '', '', '', '', '', NULL, '', '', NULL, './uploads/applicants_img/'),
(11, 202, 'Ms.', 'nikki', '', 0, 'shahpura bhopal', '', '', '', '', '', '', '', NULL, '', '', '', '', '', '', '0.00', '', '', '', '', NULL, './uploads/applicants_img/'),
(12, 203, '', '', '', 0, '', '', '', '', '', '', '', '', NULL, '', '', '', '', '', '', '', '', NULL, '', '', NULL, './uploads/applicants_img/'),
(13, 204, 'Mr.', 'Aarti kumari', '10-03-1999', 19, 'line no 205 ,near railway station road, 80 fit road, naveen nagar bhopal ', 'line no 205 ,near railway station road, 80 fit road, naveen nagar bhopal ', '', '', '', '', '', '8989898989', NULL, 'nirbhayc4@gmail.com', '', '', '', '', '', '0.00', '', '', '', '', NULL, './uploads/applicants_img/female201803230346431521800203ESSARJEE SAMPADA.jpg'),
(14, 205, '', '', '', 0, '', '', '', '', '', '', '', '', NULL, '', '', '', '', '', '', '', '', NULL, '', '', NULL, './uploads/applicants_img/'),
(16, 207, '', '', '', 0, '', '', '', '', '', '', '', '', NULL, '', '', '', '', '', '', '0.00', '', '', '', '', NULL, './uploads/applicants_img/'),
(17, 208, '', '', '', 0, '', '', '', '', '', '', '', '', NULL, '', '', '', '', '', '', '0.00', '', '', '', '', NULL, './uploads/applicants_img/'),
(18, 219, 'Mr.', 'Ram', '02-03-1977', 41, 'bhopal', 'bhopal', '461232', 'S/o.', 'Mr.', 'Shyam', '', '', NULL, '', '', '', '', '', '', '0.00', '', '', '', '', NULL, './uploads/applicants_img/male_img201803070608401520402920ESSARJEE SAMPADA.jpg'),
(19, 217, 'Mr.', 'Avinash', '06-03-1973', 45, 'bhopal', 'bhopal', '968574', 'S/o.', 'Mr.', 'Raman', '', '', NULL, '', '', '', '', '', '', '0.00', '', '', '', '', NULL, './uploads/applicants_img/'),
(20, 220, 'Mr.', 'Avin', '', 0, 'bhopal', 'bhopal', '', 'S/o.', 'Mr.', 'Tezbahadur', '', '', NULL, '', '', '', '', '', '', '0.00', '', '', '', '', NULL, './uploads/applicants_img/'),
(21, 222, 'Mrs.', 'Afreen', '', 0, 'bhopal', 'bhopal', '', 'W/o', 'Mr.', 'Waseem', '', '', NULL, '', '', '', '', '', '', '', '', NULL, '', '', NULL, './uploads/applicants_img/NAFISA2201803070245331520414133ESSARJEE SAMPADA.jpg'),
(23, 226, '', '', '', 0, '', '', '', '', '', '', '', '', NULL, '', '', '', '', '', '', '', '', NULL, '', '', NULL, './uploads/applicants_img/'),
(24, 227, '', '', '', 0, '', '', '', '', '', '', '', '', NULL, '', '', '', '', '', '', '', '', NULL, '', '', NULL, './uploads/applicants_img/'),
(25, 231, '', '', '', 0, '', '', '', '', '', '', '', '', NULL, '', '', '', '', '', '', '', '', NULL, '', '', NULL, './uploads/applicants_img/'),
(26, 229, '', '', '', 0, '', '', '', '', '', '', '', '', NULL, '', '', '', '', '', '', '', '', NULL, '', '', NULL, './uploads/applicants_img/'),
(27, 232, '', '', '', 0, '', '', '', '', '', '', '', '', NULL, '', '', '', '', '', '', '', '', NULL, '', '', NULL, './uploads/applicants_img/'),
(28, 234, '', '', '', 0, '', '', '', '', '', '', '', '', NULL, '', '', '', '', '', '', '', '', NULL, '', '', NULL, './uploads/applicants_img/'),
(29, 235, '', '', '', 0, '', '', '', '', '', '', '', '', NULL, '', '', '', '', '', '', '0.00', '', '', '', '', NULL, './uploads/applicants_img/'),
(30, 236, '', '', '', 0, '', '', '', '', '', '', '', '', NULL, '', '', '', '', '', '', '', '', NULL, '', '', NULL, './uploads/applicants_img/'),
(31, 237, '', '', '', 0, '', '', '', '', '', '', '', '', NULL, '', '', '', '', '', '', '', '', NULL, '', '', NULL, './uploads/applicants_img/'),
(32, 239, '', '', '', 0, '', '', '', '', '', '', '', '', NULL, '', '', '', '', '', '', '', '', NULL, '', '', NULL, './uploads/applicants_img/'),
(33, 240, '', '', '', 0, '', '', '', '', '', '', '', '', NULL, '', '', '', '', '', '', '', '', NULL, '', '', NULL, './uploads/applicants_img/'),
(34, 242, '', '', '', 0, '', '', '', '', '', '', '', '', NULL, '', '', '', '', '', '', '', '', NULL, '', '', NULL, './uploads/applicants_img/'),
(35, 243, '', '', '', 0, '', '', '', '', '', '', '', '', NULL, '', '', '', '', '', '', '', '', NULL, '', '', NULL, './uploads/applicants_img/'),
(36, 244, '', '', '', 0, '', '', '', '', '', '', '', '', NULL, '', '', '', '', '', '', '', '', NULL, '', '', NULL, './uploads/applicants_img/'),
(37, 245, '', '', '', 0, '', '', '', '', '', '', '', '', NULL, '', '', '', '', '', '', '', '', NULL, '', '', NULL, './uploads/applicants_img/'),
(38, 247, '', '', '', 0, '', '', '', '', '', '', '', '', NULL, '', '', '', '', '', '', '', '', NULL, '', '', NULL, './uploads/applicants_img/'),
(39, 249, '', '', '', 0, '', '', '', '', '', '', '', '', NULL, '', '', '', '', '', '', '', '', NULL, '', '', NULL, './uploads/applicants_img/'),
(40, 250, '', '', '', 0, '', '', '', '', '', '', '', '', NULL, '', '', '', '', '', '', '', '', NULL, '', '', NULL, './uploads/applicants_img/'),
(41, 251, '', '', '', 0, '', '', '', '', '', '', '', '', NULL, '', '', '', '', '', '', '', '', NULL, '', '', NULL, './uploads/applicants_img/'),
(42, 252, '', '', '', 0, '', '', '', '', '', '', '', '', NULL, '', '', '', '', '', '', '', '', NULL, '', '', NULL, './uploads/applicants_img/'),
(43, 253, 'Ms.', 'Raju', '08-03-1974', 44, 'afafasfas', 'fasdfas', '454444', 'D/o.', 'Mr.', 'asdf', '989898989898', '9989098898', NULL, '', '', '', '', '', '', '0.00', '', '', '', '', NULL, './uploads/applicants_img/'),
(44, 254, '', '', '', 0, '', '', '', '', '', '', '', '', NULL, '', '', '', '', '', '', '', '', NULL, '', '', NULL, './uploads/applicants_img/Paayal201803230722471521813167ESSARJEE SAMPADA.jpg'),
(45, 255, '', '', '', 0, '', '', '', '', '', '', '', '', NULL, '', '', '', '', '', '', '0.00', '', '', '', '', NULL, './uploads/applicants_img/'),
(46, 256, '', '', '', 0, '', '', '', '', '', '', '', '', NULL, '', '', '', '', '', '', '', '', NULL, '', '', NULL, './uploads/applicants_img/'),
(47, 257, '', '', '', 0, '', '', '', '', '', '', '', '', NULL, '', '', '', '', '', '', '', '', NULL, '', '', NULL, './uploads/applicants_img/'),
(48, 258, '', '', '', 0, '', '', '', '', '', '', '', '', NULL, '', '', '', '', '', '', '', '', NULL, '', '', NULL, './uploads/applicants_img/'),
(49, 259, '', '', '', 0, '', '', '', '', '', '', '', '', NULL, '', '', '', '', '', '', '', '', NULL, '', '', NULL, './uploads/applicants_img/'),
(50, 260, '', '', '', 0, '', '', '', '', '', '', '', '', NULL, '', '', '', '', '', '', '', '', NULL, '', '', NULL, './uploads/applicants_img/'),
(51, 261, '', '', '', 0, '', '', '', '', '', '', '', '', NULL, '', '', '', '', '', '', '', '', NULL, '', '', NULL, './uploads/applicants_img/'),
(52, 260, '', '', '', 0, '', '', '', '', '', '', '', '', NULL, '', '', '', '', '', '', '', '', NULL, '', '', NULL, './uploads/applicants_img/'),
(53, 260, '', '', '', 0, '', '', '', '', '', '', '', '', NULL, '', '', '', '', '', '', '', '', NULL, '', '', NULL, './uploads/applicants_img/'),
(54, 263, '', '', '', 0, '', '', '', '', '', '', '', '', NULL, '', '', '', '', '', '', '', '', NULL, '', '', NULL, './uploads/applicants_img/'),
(55, 264, '', '', '', 0, '', '', '', '', '', '', '', '', NULL, '', '', '', '', '', '', '', '', NULL, '', '', NULL, './uploads/applicants_img/'),
(58, 267, '', '', '', 0, '', '', '', '', '', '', '', '', NULL, '', '', '', '', '', '', '', '', NULL, '', '', NULL, './uploads/applicants_img/'),
(59, 268, '', '', '', 0, '', '', '', '', '', '', '', '', NULL, '', '', '', '', '', '', '', '', NULL, '', '', NULL, './uploads/applicants_img/'),
(60, 269, '', '', '', 0, '', '', '', '', '', '', '', '', NULL, '', '', '', '', '', '', '', '', NULL, '', '', NULL, './uploads/applicants_img/'),
(61, 270, '', '', '', 0, '', '', '', '', '', '', '', '', NULL, '', '', '', '', '', '', '', '', NULL, '', '', NULL, './uploads/applicants_img/');

-- --------------------------------------------------------

--
-- Table structure for table `co_applicant_tbl_1`
--

CREATE TABLE `co_applicant_tbl_1` (
  `id` int(11) NOT NULL,
  `first_appl_id_1` int(11) NOT NULL,
  `ca_mr_mrs_1` varchar(10) CHARACTER SET utf8 COLLATE utf8_unicode_ci DEFAULT NULL,
  `ca_name_1` varchar(50) CHARACTER SET utf8 COLLATE utf8_unicode_ci NOT NULL,
  `ca_dob_1` varchar(45) CHARACTER SET utf8 COLLATE utf8_unicode_ci DEFAULT NULL,
  `ca_age_1` int(10) DEFAULT NULL,
  `co_present_add_1` varchar(255) CHARACTER SET utf8 COLLATE utf8_unicode_ci DEFAULT NULL,
  `co_parma_add_1` varchar(255) CHARACTER SET utf8 COLLATE utf8_unicode_ci DEFAULT NULL,
  `ca_pincode_1` varchar(20) CHARACTER SET utf8 COLLATE utf8_unicode_ci DEFAULT NULL,
  `ca_son_doughter_wife_1` varchar(30) CHARACTER SET utf8 COLLATE utf8_unicode_ci DEFAULT NULL,
  `ca_son_doughter_wife_mr_mrs_1` varchar(150) CHARACTER SET utf8 COLLATE utf8_unicode_ci DEFAULT NULL,
  `ca_swd_of_1` varchar(30) CHARACTER SET utf8 COLLATE utf8_unicode_ci DEFAULT NULL,
  `ca_aadhar_no_1` varchar(12) CHARACTER SET utf8 COLLATE utf8_unicode_ci DEFAULT NULL,
  `ca_mo_no_1` varchar(10) CHARACTER SET utf8 COLLATE utf8_unicode_ci DEFAULT NULL,
  `ca_landline_no_1` varchar(45) CHARACTER SET utf8 COLLATE utf8_unicode_ci DEFAULT NULL,
  `ca_email_1` varchar(50) CHARACTER SET utf8 COLLATE utf8_unicode_ci DEFAULT NULL,
  `ca_pan_1` varchar(50) CHARACTER SET utf8 COLLATE utf8_unicode_ci DEFAULT NULL,
  `ca_company_name_1` varchar(50) CHARACTER SET utf8 COLLATE utf8_unicode_ci DEFAULT NULL,
  `ca_doj_1` varchar(45) CHARACTER SET utf8 COLLATE utf8_unicode_ci DEFAULT NULL,
  `ca_desig_1` varchar(60) CHARACTER SET utf8 COLLATE utf8_unicode_ci DEFAULT NULL,
  `ca_department_1` varchar(60) CHARACTER SET utf8 COLLATE utf8_unicode_ci DEFAULT NULL,
  `ca_monthly_income_1` varchar(30) CHARACTER SET utf8 COLLATE utf8_unicode_ci DEFAULT NULL,
  `ca_Qualification_1` varchar(30) CHARACTER SET utf8 COLLATE utf8_unicode_ci DEFAULT NULL,
  `ca_occupation_1` varchar(50) CHARACTER SET utf8 COLLATE utf8_unicode_ci DEFAULT NULL,
  `ca_addr_of_employer_1` varchar(50) CHARACTER SET utf8 COLLATE utf8_unicode_ci DEFAULT NULL,
  `ca_addr_of_pincode_1` varchar(45) CHARACTER SET utf8 COLLATE utf8_unicode_ci NOT NULL,
  `ca_bank_name_ac_no_1` int(20) DEFAULT NULL,
  `ca_img_path_1` varchar(150) CHARACTER SET utf8 COLLATE utf8_unicode_ci DEFAULT NULL
) ENGINE=InnoDB DEFAULT CHARSET=latin1;

--
-- Dumping data for table `co_applicant_tbl_1`
--

INSERT INTO `co_applicant_tbl_1` (`id`, `first_appl_id_1`, `ca_mr_mrs_1`, `ca_name_1`, `ca_dob_1`, `ca_age_1`, `co_present_add_1`, `co_parma_add_1`, `ca_pincode_1`, `ca_son_doughter_wife_1`, `ca_son_doughter_wife_mr_mrs_1`, `ca_swd_of_1`, `ca_aadhar_no_1`, `ca_mo_no_1`, `ca_landline_no_1`, `ca_email_1`, `ca_pan_1`, `ca_company_name_1`, `ca_doj_1`, `ca_desig_1`, `ca_department_1`, `ca_monthly_income_1`, `ca_Qualification_1`, `ca_occupation_1`, `ca_addr_of_employer_1`, `ca_addr_of_pincode_1`, `ca_bank_name_ac_no_1`, `ca_img_path_1`) VALUES
(1, 194, '', '', '', 0, '', '', '', '', '', '', '', '', NULL, '', '', '', '', '', '', '', '', NULL, '', '', NULL, './uploads/applicants_img/'),
(2, 195, '', '', '', 0, '', '', '', '', '', '', '', '', NULL, '', '', '', '', '', '', '', '', NULL, '', '', NULL, './uploads/applicants_img/'),
(3, 196, 'Ms.', 'Rati Mishra', '', 0, '', '', '', 'D/o.', 'Mr.', 'Rahul Mishra', '', '', NULL, '', '', '', '', '', '', '0.00', '', '', '', '', NULL, './uploads/applicants_img/ramu7201802270405341519727734ESSARJEE SAMPADA.jpg'),
(4, 196, 'Ms.', 'Rati Mishra', '', 0, '', '', '', 'D/o.', 'Mr.', 'Rahul Mishra', '', '', NULL, '', '', '', '', '', '', '0.00', '', '', '', '', NULL, './uploads/applicants_img/rani2201802270408521519727932ESSARJEE SAMPADA.jpg'),
(5, 196, 'Ms.', 'Rati Mishra', '', 0, '', '', '', 'D/o.', 'Mr.', 'Rahul Mishra', '', '', NULL, '', '', '', '', '', '', '0.00', '', '', '', '', NULL, './uploads/applicants_img/rani2201802270411201519728080ESSARJEE SAMPADA.jpg'),
(6, 197, '', '', '', 0, '', '', '', '', '', '', '', '', NULL, '', '', '', '', '', '', '0.00', '', '', '', '', NULL, './uploads/applicants_img/'),
(7, 198, '', '', '', 0, '', '', '', '', '', '', '', '', NULL, '', '', '', '', '', '', '', '', NULL, '', '', NULL, './uploads/applicants_img/'),
(8, 199, '', '', '', 0, '', '', '', '', '', '', '', '', NULL, '', '', '', '', '', '', '', '', NULL, '', '', NULL, './uploads/applicants_img/'),
(9, 200, '', '', '', 0, '', '', '', '', '', '', '', '', NULL, '', '', '', '', '', '', '', '', NULL, '', '', NULL, './uploads/applicants_img/'),
(10, 201, '', '', '', 0, '', '', '', '', '', '', '', '', NULL, '', '', '', '', '', '', '', '', NULL, '', '', NULL, './uploads/applicants_img/'),
(11, 202, '', '', '', 0, '', '', '', '', '', '', '', '', NULL, '', '', '', '', '', '', '0.00', '', '', '', '', NULL, './uploads/applicants_img/'),
(12, 203, '', '', '', 0, '', '', '', '', '', '', '', '', NULL, '', '', '', '', '', '', '', '', NULL, '', '', NULL, './uploads/applicants_img/'),
(13, 204, 'Ms.', 'Kavita kumari', '10-03-1999', 19, 'line no 205 ,near railway station road, 80 fit road, naveen nagar bhopal ', 'line no 205 ,near railway station road, 80 fit road, naveen nagar bhopal ', '', '', '', '', '', '8989898989', NULL, 'nirbhayc4@gmail.com', '', '', '', '', '', '0.00', '', '', '', '', NULL, './uploads/applicants_img/female2201803230405181521801318ESSARJEE SAMPADA.jpg'),
(14, 205, '', '', '', 0, '', '', '', '', '', '', '', '', NULL, '', '', '', '', '', '', '', '', NULL, '', '', NULL, './uploads/applicants_img/'),
(15, 206, '', '', '', 0, '', '', '', '', '', '', '', '', NULL, '', '', '', '', '', '', '0.00', '', '', '', '', NULL, './uploads/applicants_img/'),
(16, 207, '', '', '', 0, '', '', '', '', '', '', '', '', NULL, '', '', '', '', '', '', '0.00', '', '', '', '', NULL, './uploads/applicants_img/'),
(17, 208, '', '', '', 0, '', '', '', '', '', '', '', '', NULL, '', '', '', '', '', '', '0.00', '', '', '', '', NULL, './uploads/applicants_img/'),
(18, 219, '', '', '', 0, '', '', '', '', '', '', '', '', NULL, '', '', '', '', '', '', '0.00', '', '', '', '', NULL, './uploads/applicants_img/'),
(19, 217, '', '', '', 0, '', '', '', '', '', '', '', '', NULL, '', '', '', '', '', '', '0.00', '', '', '', '', NULL, './uploads/applicants_img/'),
(20, 220, '', '', '', 0, '', '', '', '', '', '', '', '', NULL, '', '', '', '', '', '', '0.00', '', '', '', '', NULL, './uploads/applicants_img/'),
(21, 222, '', '', '', 0, '', '', '', '', '', '', '', '', NULL, '', '', '', '', '', '', '', '', NULL, '', '', NULL, './uploads/applicants_img/'),
(22, 225, '', '', '', 0, '', '', '', '', '', '', '', '', NULL, '', '', '', '', '', '', '', '', NULL, '', '', NULL, './uploads/applicants_img/'),
(23, 226, '', '', '', 0, '', '', '', '', '', '', '', '', NULL, '', '', '', '', '', '', '', '', NULL, '', '', NULL, './uploads/applicants_img/'),
(24, 227, '', '', '', 0, '', '', '', '', '', '', '', '', NULL, '', '', '', '', '', '', '', '', NULL, '', '', NULL, './uploads/applicants_img/'),
(25, 231, '', '', '', 0, '', '', '', '', '', '', '', '', NULL, '', '', '', '', '', '', '', '', NULL, '', '', NULL, './uploads/applicants_img/'),
(26, 229, '', '', '', 0, '', '', '', '', '', '', '', '', NULL, '', '', '', '', '', '', '', '', NULL, '', '', NULL, './uploads/applicants_img/'),
(27, 232, '', '', '', 0, '', '', '', '', '', '', '', '', NULL, '', '', '', '', '', '', '', '', NULL, '', '', NULL, './uploads/applicants_img/'),
(28, 234, '', '', '', 0, '', '', '', '', '', '', '', '', NULL, '', '', '', '', '', '', '', '', NULL, '', '', NULL, './uploads/applicants_img/'),
(29, 235, '', '', '', 0, '', '', '', '', '', '', '', '', NULL, '', '', '', '', '', '', '0.00', '', '', '', '', NULL, './uploads/applicants_img/'),
(30, 236, '', '', '', 0, '', '', '', '', '', '', '', '', NULL, '', '', '', '', '', '', '', '', NULL, '', '', NULL, './uploads/applicants_img/'),
(31, 237, '', '', '', 0, '', '', '', '', '', '', '', '', NULL, '', '', '', '', '', '', '', '', NULL, '', '', NULL, './uploads/applicants_img/'),
(32, 239, '', '', '', 0, '', '', '', '', '', '', '', '', NULL, '', '', '', '', '', '', '', '', NULL, '', '', NULL, './uploads/applicants_img/'),
(33, 240, '', '', '', 0, '', '', '', '', '', '', '', '', NULL, '', '', '', '', '', '', '', '', NULL, '', '', NULL, './uploads/applicants_img/'),
(34, 242, '', '', '', 0, '', '', '', '', '', '', '', '', NULL, '', '', '', '', '', '', '', '', NULL, '', '', NULL, './uploads/applicants_img/'),
(35, 243, '', '', '', 0, '', '', '', '', '', '', '', '', NULL, '', '', '', '', '', '', '', '', NULL, '', '', NULL, './uploads/applicants_img/'),
(36, 244, '', '', '', 0, '', '', '', '', '', '', '', '', NULL, '', '', '', '', '', '', '', '', NULL, '', '', NULL, './uploads/applicants_img/'),
(37, 245, '', '', '', 0, '', '', '', '', '', '', '', '', NULL, '', '', '', '', '', '', '', '', NULL, '', '', NULL, './uploads/applicants_img/'),
(38, 247, '', '', '', 0, '', '', '', '', '', '', '', '', NULL, '', '', '', '', '', '', '', '', NULL, '', '', NULL, './uploads/applicants_img/'),
(39, 249, '', '', '', 0, '', '', '', '', '', '', '', '', NULL, '', '', '', '', '', '', '', '', NULL, '', '', NULL, './uploads/applicants_img/'),
(40, 250, '', '', '', 0, '', '', '', '', '', '', '', '', NULL, '', '', '', '', '', '', '', '', NULL, '', '', NULL, './uploads/applicants_img/'),
(41, 251, '', '', '', 0, '', '', '', '', '', '', '', '', NULL, '', '', '', '', '', '', '', '', NULL, '', '', NULL, './uploads/applicants_img/'),
(42, 252, '', '', '', 0, '', '', '', '', '', '', '', '', NULL, '', '', '', '', '', '', '', '', NULL, '', '', NULL, './uploads/applicants_img/'),
(43, 253, '', '', '', 0, '', '', '', '', '', '', '', '', NULL, '', '', '', '', '', '', '0.00', '', '', '', '', NULL, './uploads/applicants_img/'),
(44, 254, '', '', '', 0, '', '', '', '', '', '', '', '', NULL, '', '', '', '', '', '', '', '', NULL, '', '', NULL, './uploads/applicants_img/'),
(45, 255, '', '', '', 0, '', '', '', '', '', '', '', '', NULL, '', '', '', '', '', '', '0.00', '', '', '', '', NULL, './uploads/applicants_img/'),
(46, 256, '', '', '', 0, '', '', '', '', '', '', '', '', NULL, '', '', '', '', '', '', '', '', NULL, '', '', NULL, './uploads/applicants_img/'),
(47, 257, '', '', '', 0, '', '', '', '', '', '', '', '', NULL, '', '', '', '', '', '', '', '', NULL, '', '', NULL, './uploads/applicants_img/'),
(48, 258, '', '', '', 0, '', '', '', '', '', '', '', '', NULL, '', '', '', '', '', '', '', '', NULL, '', '', NULL, './uploads/applicants_img/'),
(49, 259, '', '', '', 0, '', '', '', '', '', '', '', '', NULL, '', '', '', '', '', '', '', '', NULL, '', '', NULL, './uploads/applicants_img/'),
(50, 260, '', '', '', 0, '', '', '', '', '', '', '', '', NULL, '', '', '', '', '', '', '', '', NULL, '', '', NULL, './uploads/applicants_img/'),
(51, 261, '', '', '', 0, '', '', '', '', '', '', '', '', NULL, '', '', '', '', '', '', '', '', NULL, '', '', NULL, './uploads/applicants_img/'),
(52, 260, '', '', '', 0, '', '', '', '', '', '', '', '', NULL, '', '', '', '', '', '', '', '', NULL, '', '', NULL, './uploads/applicants_img/'),
(53, 260, '', '', '', 0, '', '', '', '', '', '', '', '', NULL, '', '', '', '', '', '', '', '', NULL, '', '', NULL, './uploads/applicants_img/'),
(54, 263, '', '', '', 0, '', '', '', '', '', '', '', '', NULL, '', '', '', '', '', '', '', '', NULL, '', '', NULL, './uploads/applicants_img/'),
(55, 264, '', '', '', 0, '', '', '', '', '', '', '', '', NULL, '', '', '', '', '', '', '', '', NULL, '', '', NULL, './uploads/applicants_img/'),
(56, 265, '', '', '', 0, '', '', '', '', '', '', '', '', NULL, '', '', '', '', '', '', '', '', NULL, '', '', NULL, './uploads/applicants_img/'),
(57, 266, '', '', '', 0, '', '', '', '', '', '', '', '', NULL, '', '', '', '', '', '', '', '', NULL, '', '', NULL, './uploads/applicants_img/'),
(58, 267, '', '', '', 0, '', '', '', '', '', '', '', '', NULL, '', '', '', '', '', '', '', '', NULL, '', '', NULL, './uploads/applicants_img/'),
(59, 268, '', '', '', 0, '', '', '', '', '', '', '', '', NULL, '', '', '', '', '', '', '', '', NULL, '', '', NULL, './uploads/applicants_img/'),
(60, 269, '', '', '', 0, '', '', '', '', '', '', '', '', NULL, '', '', '', '', '', '', '', '', NULL, '', '', NULL, './uploads/applicants_img/'),
(61, 270, '', '', '', 0, '', '', '', '', '', '', '', '', NULL, '', '', '', '', '', '', '', '', NULL, '', '', NULL, './uploads/applicants_img/');

-- --------------------------------------------------------

--
-- Table structure for table `demand_letter_tbl`
--

CREATE TABLE `demand_letter_tbl` (
  `id` int(11) NOT NULL,
  `appl_id` int(11) NOT NULL,
  `unit_no` varchar(45) COLLATE utf8_unicode_ci NOT NULL,
  `type` varchar(45) COLLATE utf8_unicode_ci NOT NULL,
  `project_name` varchar(45) COLLATE utf8_unicode_ci NOT NULL,
  `block` varchar(45) COLLATE utf8_unicode_ci NOT NULL,
  `stage` varchar(45) COLLATE utf8_unicode_ci NOT NULL,
  `step_no` int(11) DEFAULT NULL,
  `currents_date` date NOT NULL,
  `due_date` date NOT NULL,
  `amount` decimal(10,2) NOT NULL,
  `amount1` decimal(10,2) NOT NULL,
  `due_amount` decimal(10,2) NOT NULL,
  `image_path` varchar(150) COLLATE utf8_unicode_ci NOT NULL,
  `adv_amt` decimal(10,2) DEFAULT '0.00',
  `cumulative_amt` decimal(10,2) DEFAULT NULL
) ENGINE=InnoDB DEFAULT CHARSET=utf8 COLLATE=utf8_unicode_ci;

--
-- Dumping data for table `demand_letter_tbl`
--

INSERT INTO `demand_letter_tbl` (`id`, `appl_id`, `unit_no`, `type`, `project_name`, `block`, `stage`, `step_no`, `currents_date`, `due_date`, `amount`, `amount1`, `due_amount`, `image_path`, `adv_amt`, `cumulative_amt`) VALUES
(1, 200, 'GF-11', 'Flat', '1', '', 'BOOKING', 1, '2018-02-01', '2018-02-16', '0.00', '110306.28', '0.00', '', '0.00', '110306.28'),
(2, 200, 'GF-11', 'Flat', '1', '', 'Excavation Work', 2, '2018-02-02', '2018-02-17', '0.00', '110306.28', '0.00', '', '0.00', '120612.56'),
(3, 194, 'H-123', 'Duplex', '2', 'Phase-1', 'BOOKING', 1, '2018-02-15', '2018-03-02', '0.00', '152500.00', '0.00', '', '0.00', NULL),
(4, 194, 'H-123', 'Duplex', '2', 'Phase-1', 'FOUNDATION', 2, '2018-02-15', '2018-03-02', '0.00', '228750.00', '0.00', '', '0.00', NULL),
(5, 194, 'H-123', 'Duplex', '2', 'Phase-1', 'PLINTH', 3, '2018-02-15', '2018-03-02', '0.00', '228750.00', '0.00', '', '0.00', NULL),
(6, 194, 'H-123', 'Duplex', '2', 'Phase-1', 'GF SLAB', 4, '2018-02-15', '2018-03-02', '0.00', '228750.00', '0.00', '', '0.00', NULL),
(7, 194, 'H-123', 'Duplex', '2', 'Phase-1', 'FF SLAB', 5, '2018-02-15', '2018-03-02', '0.00', '152500.00', '0.00', '', '0.00', NULL),
(8, 194, 'H-123', 'Duplex', '2', 'Phase-1', 'BRICK WORK', 6, '2018-02-15', '2018-03-02', '0.00', '122000.00', '0.00', '', '0.00', NULL),
(9, 194, 'H-123', 'Duplex', '2', 'Phase-1', 'PLASTER WORK', 7, '2018-02-15', '2018-03-02', '0.00', '122000.00', '0.00', '', '0.00', NULL),
(10, 194, 'H-123', 'Duplex', '2', 'Phase-1', 'PAINTING/FINISHING', 8, '2018-02-15', '2018-03-02', '0.00', '137250.00', '0.00', '', '0.00', '1372500.00'),
(11, 207, 'H-101', 'Duplex', '2', 'Phase-1', 'BOOKING', 1, '2018-03-01', '2018-03-16', '0.00', '348128.15', '0.00', 'uploads/site_images/asdf220180305115657_.jpeg', '0.00', '696128.15'),
(12, 207, 'H-101', 'Duplex', '2', 'Phase-1', 'FOUNDATION', 2, '2018-03-08', '2018-03-23', '0.00', '522192.23', '0.00', '', '0.00', '1044192.23'),
(13, 208, 'H-102', 'Duplex', '2', 'Phase-1', 'BOOKING', 1, '2018-03-01', '2018-03-16', '0.00', '348000.00', '0.00', '', '0.00', '348000.00'),
(14, 208, 'H-102', 'Duplex', '2', 'Phase-1', 'FOUNDATION', 2, '2018-03-09', '2018-03-24', '0.00', '522000.00', '0.00', '', '0.00', NULL),
(15, 208, 'H-102', 'Duplex', '2', 'Phase-1', 'PLINTH', 3, '2018-03-09', '2018-03-24', '0.00', '522000.00', '0.00', '', '0.00', NULL),
(16, 208, 'H-102', 'Duplex', '2', 'Phase-1', 'GF SLAB', 4, '2018-03-09', '2018-03-24', '0.00', '522000.00', '0.00', '', '0.00', NULL),
(17, 208, 'H-102', 'Duplex', '2', 'Phase-1', 'FF SLAB', 5, '2018-03-09', '2018-03-24', '0.00', '348000.00', '0.00', '', '0.00', NULL),
(18, 208, 'H-102', 'Duplex', '2', 'Phase-1', 'BRICK WORK', 6, '2018-03-09', '2018-03-24', '0.00', '278400.00', '0.00', '', '0.00', NULL),
(19, 208, 'H-102', 'Duplex', '2', 'Phase-1', 'PLASTER WORK', 7, '2018-03-09', '2018-03-24', '0.00', '278400.00', '0.00', '', '0.00', NULL),
(20, 208, 'H-102', 'Duplex', '2', 'Phase-1', 'PAINTING/FINISHING', 8, '2018-03-09', '2018-03-24', '0.00', '313200.00', '0.00', '', '0.00', NULL),
(21, 208, 'H-102', 'Duplex', '2', 'Phase-1', 'POSSESSION', 9, '2018-03-09', '2018-03-24', '3132000.00', '348000.00', '0.00', '', '0.00', '3132000.00'),
(22, 220, 'H-57', 'Duplex', '1', 'Phase-2', 'BOOKING', 1, '2018-02-07', '2018-02-22', '0.00', '381500.00', '0.00', '', '0.00', '381500.00'),
(23, 220, 'H-57', 'Duplex', '1', 'Phase-2', 'FOUNDATION', 2, '2018-02-21', '2018-03-08', '0.00', '572250.00', '0.00', '', '0.00', NULL),
(24, 220, 'H-57', 'Duplex', '1', 'Phase-2', 'PLINTH', 3, '2018-02-21', '2018-03-08', '0.00', '572250.00', '0.00', '', '1000000.00', '1446000.00'),
(25, 206, 'GF-1', 'Flat', '1', 'Phase-2', 'BOOKING', 1, '2018-02-05', '2018-02-20', '0.00', '176800.00', '0.00', '', '0.00', '176800.00'),
(26, 206, 'GF-1', 'Flat', '1', 'Phase-2', 'EXCAVATION WORK', 2, '2018-01-11', '2018-01-26', '0.00', '176800.00', '0.00', '', '0.00', NULL),
(27, 206, 'GF-1', 'Flat', '1', 'Phase-2', 'FOUNDATION', 3, '2018-01-11', '2018-01-26', '0.00', '212160.00', '0.00', '', '0.00', NULL),
(28, 206, 'GF-1', 'Flat', '1', 'Phase-2', 'PLINTH', 4, '2018-01-11', '2018-01-26', '0.00', '212160.00', '0.00', '', '0.00', NULL),
(29, 206, 'GF-1', 'Flat', '1', 'Phase-2', 'FIRST FLOOR SLAB', 5, '2018-01-11', '2018-01-26', '912560.00', '141440.00', '0.00', '', '0.00', '912560.00'),
(30, 222, 'H-74', 'Plot', '1', 'Phase-2', 'Road Development and Surface  Drain Network', 1, '2018-02-08', '2018-02-23', '200000.00', '250000.00', '200000.00', '', '0.00', '250000.00'),
(31, 205, 'H-253', 'Duplex', '2', 'Phase-1', 'BOOKING', 1, '2018-03-15', '2018-03-30', '0.00', '348154.31', '0.00', '', '0.00', NULL),
(32, 205, 'H-253', 'Duplex', '2', 'Phase-1', 'FOUNDATION', 2, '2018-03-15', '2018-03-30', '870385.77', '522231.46', '870385.77', '', '0.00', '870385.77'),
(33, 229, 'H-59', 'Duplex', '1', 'Phase-2', 'BOOKING', 1, '2018-03-09', '2018-03-24', '260310.75', '381522.75', '260310.75', '', '0.00', '381522.75'),
(34, 235, 'H-233', 'Duplex', '1', 'Phase-2', 'BOOKING', 1, '2018-03-09', '2018-03-24', '0.00', '600000.00', '0.00', '', '0.00', '600000.00'),
(35, 235, 'H-233', 'Duplex', '1', 'Phase-2', 'FOUNDATION', 2, '2018-03-09', '2018-03-24', '0.00', '900000.00', '0.00', '', '0.00', NULL),
(36, 235, 'H-233', 'Duplex', '1', 'Phase-2', 'PLINTH', 3, '2018-03-09', '2018-03-24', '0.00', '900000.00', '0.00', '', '0.00', NULL),
(37, 235, 'H-233', 'Duplex', '1', 'Phase-2', 'GF SLAB', 4, '2018-03-09', '2018-03-24', '0.00', '900000.00', '0.00', '', '0.00', NULL),
(38, 235, 'H-233', 'Duplex', '1', 'Phase-2', 'FF SLAB', 5, '2018-03-09', '2018-03-24', '0.00', '600000.00', '0.00', '', '0.00', NULL),
(39, 235, 'H-233', 'Duplex', '1', 'Phase-2', 'BRICK WORK', 6, '2018-03-09', '2018-03-24', '0.00', '480000.00', '0.00', '', '0.00', NULL),
(40, 235, 'H-233', 'Duplex', '1', 'Phase-2', 'PLASTER WORK', 7, '2018-03-09', '2018-03-24', '0.00', '480000.00', '0.00', '', '0.00', NULL),
(41, 235, 'H-233', 'Duplex', '1', 'Phase-2', 'PAINTING/FINISHING', 8, '2018-03-09', '2018-03-24', '0.00', '540000.00', '0.00', '', '0.00', '4900000.00'),
(42, 235, 'H-233', 'Duplex', '1', 'Phase-2', 'POSSESSION', 9, '2018-03-09', '2018-03-24', '0.00', '600000.00', '0.00', '', '0.00', '500000.00'),
(43, 236, 'GF-4', 'Flat', '1', 'Phase-2', 'BOOKING', 1, '2018-03-09', '2018-03-24', '0.00', '285140.55', '0.00', '', '0.00', '285140.55'),
(44, 236, 'GF-4', 'Flat', '1', 'Phase-2', 'EXCAVATION WORK', 2, '2018-03-09', '2018-03-24', '0.00', '285140.55', '0.00', '', '0.00', NULL),
(45, 236, 'GF-4', 'Flat', '1', 'Phase-2', 'FOUNDATION', 3, '2018-03-09', '2018-03-24', '0.00', '342168.66', '0.00', '', '0.00', NULL),
(46, 236, 'GF-4', 'Flat', '1', 'Phase-2', 'PLINTH', 4, '2018-03-09', '2018-03-24', '0.00', '342168.66', '0.00', '', '0.00', '969477.87'),
(47, 236, 'GF-4', 'Flat', '1', 'Phase-2', 'FIRST FLOOR SLAB', 5, '2018-03-09', '2018-03-24', '0.00', '228112.44', '0.00', '', '0.00', NULL),
(48, 236, 'GF-4', 'Flat', '1', 'Phase-2', 'SECOND FLOOR SLAB', 6, '2018-03-09', '2018-03-24', '0.00', '142570.28', '0.00', '', '0.00', NULL),
(49, 236, 'GF-4', 'Flat', '1', 'Phase-2', 'THIRD FLOOR SLAB', 7, '2018-03-09', '2018-03-24', '0.00', '142570.28', '0.00', '', '0.00', NULL),
(50, 236, 'GF-4', 'Flat', '1', 'Phase-2', 'FOURTH FLOOR SLAB', 8, '2018-03-09', '2018-03-24', '0.00', '142570.28', '0.00', '', '0.00', NULL),
(51, 236, 'GF-4', 'Flat', '1', 'Phase-2', 'FIFTH FLOOR SLAB', 9, '2018-03-09', '2018-03-24', '0.00', '142570.28', '0.00', '', '0.00', NULL),
(52, 236, 'GF-4', 'Flat', '1', 'Phase-2', 'SIXTH FLOOR SLAB', 10, '2018-03-09', '2018-03-24', '0.00', '142570.28', '0.00', '', '0.00', NULL),
(53, 236, 'GF-4', 'Flat', '1', 'Phase-2', 'SEVENTH FLOOR SLAB', 11, '2018-03-09', '2018-03-24', '0.00', '142570.28', '0.00', '', '0.00', NULL),
(54, 236, 'GF-4', 'Flat', '1', 'Phase-2', 'BRICK WORK', 12, '2018-03-09', '2018-03-24', '0.00', '142570.28', '0.00', '', '0.00', NULL),
(55, 236, 'GF-4', 'Flat', '1', 'Phase-2', 'PLASTER WORK', 13, '2018-03-09', '2018-03-24', '0.00', '142570.28', '0.00', '', '0.00', NULL),
(56, 236, 'GF-4', 'Flat', '1', 'Phase-2', 'FLOORING AND FINISHING', 14, '2018-03-09', '2018-03-24', '0.00', '142570.28', '0.00', '', '0.00', NULL),
(57, 236, 'GF-4', 'Flat', '1', 'Phase-2', 'POSSESSION', 15, '2018-03-09', '2018-03-24', '0.00', '285140.55', '0.00', '', '0.00', '1796385.51'),
(58, 237, 'GF-5', 'Flat', '1', 'Phase-2', 'BOOKING', 1, '2018-03-09', '2018-03-24', '0.00', '170000.00', '0.00', '', '0.00', '170000.00'),
(59, 237, 'GF-5', 'Flat', '1', 'Phase-2', 'EXCAVATION WORK', 2, '2018-03-09', '2018-03-24', '0.00', '170000.00', '0.00', '', '0.00', NULL),
(60, 237, 'GF-5', 'Flat', '1', 'Phase-2', 'FOUNDATION', 3, '2018-03-09', '2018-03-24', '0.00', '204000.00', '0.00', '', '0.00', NULL),
(61, 237, 'GF-5', 'Flat', '1', 'Phase-2', 'PLINTH', 4, '2018-03-09', '2018-03-24', '0.00', '136000.00', '0.00', '', '0.00', NULL),
(62, 237, 'GF-5', 'Flat', '1', 'Phase-2', 'FIRST FLOOR SLAB', 5, '2018-03-09', '2018-03-24', '0.00', '85000.00', '0.00', '', '0.00', NULL),
(63, 237, 'GF-5', 'Flat', '1', 'Phase-2', 'SECOND FLOOR SLAB', 6, '2018-03-09', '2018-03-24', '0.00', '85000.00', '0.00', '', '0.00', NULL),
(64, 237, 'GF-5', 'Flat', '1', 'Phase-2', 'THIRD FLOOR SLAB', 7, '2018-03-09', '2018-03-24', '0.00', '85000.00', '0.00', '', '0.00', NULL),
(65, 237, 'GF-5', 'Flat', '1', 'Phase-2', 'FOURTH FLOOR SLAB', 8, '2018-03-09', '2018-03-24', '0.00', '85000.00', '0.00', '', '0.00', NULL),
(66, 237, 'GF-5', 'Flat', '1', 'Phase-2', 'FIFTH FLOOR SLAB', 9, '2018-03-09', '2018-03-24', '0.00', '85000.00', '0.00', '', '0.00', NULL),
(67, 237, 'GF-5', 'Flat', '1', 'Phase-2', 'SIXTH FLOOR SLAB', 10, '2018-03-09', '2018-03-24', '0.00', '85000.00', '0.00', '', '0.00', NULL),
(68, 237, 'GF-5', 'Flat', '1', 'Phase-2', 'SEVENTH FLOOR SLAB', 11, '2018-03-09', '2018-03-24', '0.00', '85000.00', '0.00', '', '0.00', NULL),
(69, 237, 'GF-5', 'Flat', '1', 'Phase-2', 'BRICK WORK', 12, '2018-03-09', '2018-03-24', '0.00', '85000.00', '0.00', '', '0.00', '1190000.00'),
(70, 237, 'GF-5', 'Flat', '1', 'Phase-2', 'PLASTER WORK', 13, '2018-03-09', '2018-03-24', '0.00', '85000.00', '0.00', '', '0.00', NULL),
(71, 237, 'GF-5', 'Flat', '1', 'Phase-2', 'FLOORING AND FINISHING', 14, '2018-03-09', '2018-03-24', '0.00', '85000.00', '0.00', '', '0.00', NULL),
(72, 237, 'GF-5', 'Flat', '1', 'Phase-2', 'POSSESSION', 15, '2018-03-09', '2018-03-24', '0.00', '170000.00', '0.00', '', '0.00', '240000.00'),
(73, 240, 'GF-3', 'Flat', '1', 'Phase-2', 'BOOKING', 1, '2018-03-09', '2018-03-24', '110306.28', '110306.28', '0.00', '', '0.00', '110306.28'),
(74, 207, 'H-101', 'Duplex', '2', 'Phase-1', 'PLINTH', 3, '2018-03-01', '2018-03-16', '0.00', '522192.23', '0.00', '', '0.00', NULL),
(75, 207, 'H-101', 'Duplex', '2', 'Phase-1', 'GF SLAB', 4, '2018-03-01', '2018-03-16', '0.00', '522192.23', '0.00', '', '0.00', NULL),
(76, 207, 'H-101', 'Duplex', '2', 'Phase-1', 'FF SLAB', 5, '2018-03-01', '2018-03-16', '0.00', '348128.15', '0.00', '', '0.00', NULL),
(77, 207, 'H-101', 'Duplex', '2', 'Phase-1', 'BRICK WORK', 6, '2018-03-01', '2018-03-16', '0.00', '278502.52', '0.00', '', '0.00', NULL),
(78, 207, 'H-101', 'Duplex', '2', 'Phase-1', 'PLASTER WORK', 7, '2018-03-01', '2018-03-16', '0.00', '278502.52', '0.00', '', '0.00', NULL),
(79, 207, 'H-101', 'Duplex', '2', 'Phase-1', 'PAINTING/FINISHING', 8, '2018-03-01', '2018-03-16', '0.00', '313315.34', '0.00', '', '0.00', NULL),
(80, 207, 'H-101', 'Duplex', '2', 'Phase-1', 'POSSESSION', 9, '2018-03-01', '2018-03-16', '6265153.37', '348128.15', '0.00', '', '0.00', '6265153.37'),
(81, 244, 'H-76', 'Plot', '1', 'Phase-2', 'Road Development and Surface  Drain Network', 1, '2018-03-10', '2018-03-25', '111.60', '250111.60', '111.60', '', '0.00', '250111.60'),
(82, 245, 'H-77', 'Plot', '1', 'Phase-2', 'Road Development and Surface  Drain Network', 1, '2018-03-10', '2018-03-25', '250111.60', '250111.60', '0.00', '', '0.00', '250111.60'),
(83, 249, 'H-81', 'Plot', '1', '', 'Road Development and Surface  Drain Network', 1, '2018-03-10', '2018-03-25', '0.00', '250000.00', '0.00', '', '0.00', '250000.00'),
(84, 249, 'H-81', 'Plot', '1', '', 'Electrical Work', 2, '2018-03-10', '2018-03-25', '0.00', '1250000.00', '0.00', '', '0.00', '1250000.00'),
(85, 249, 'H-81', 'Plot', '1', '', 'Sewer Line Network', 3, '2018-03-10', '2018-03-25', '0.00', '750000.00', '0.00', '', '0.00', '750000.00'),
(86, 249, 'H-81', 'Plot', '1', '', 'Water Supply and Garden Network', 4, '2018-03-10', '2018-03-25', '0.00', '250000.00', '0.00', '', '0.00', '300000.00'),
(87, 196, 'H-123', 'Duplex', '2', 'Phase-1', 'POSSESSION', 9, '2018-03-01', '2018-03-16', '1525000.00', '152500.00', '0.00', '', '0.00', '1525000.00'),
(88, 251, 'H-313', 'Duplex', '2', 'Phase-1', 'PLOT REGISTRY', 1, '2018-03-22', '2018-04-06', '0.00', '1199918.00', '0.00', '', '0.00', '1199918.00'),
(89, 251, 'H-313', 'Duplex', '2', 'Phase-1', 'PLOT REGISTRY', 1, '2018-03-24', '2018-04-08', '0.00', '1199918.00', '0.00', '', '0.00', NULL),
(90, 251, 'H-313', 'Duplex', '2', 'Phase-1', 'BOOKING', 2, '2018-03-24', '2018-04-08', '0.00', '109991.80', '0.00', '', '4690090.20', '1309909.80'),
(91, 251, 'H-313', 'Duplex', '2', 'Phase-1', 'BOOKING', 2, '2018-03-24', '2018-04-08', '0.00', '109991.80', '0.00', '', '0.00', NULL),
(92, 251, 'H-313', 'Duplex', '2', 'Phase-1', 'FOUNDATION', 3, '2018-03-24', '2018-04-08', '0.00', '164987.70', '0.00', '', '0.00', NULL),
(93, 251, 'H-313', 'Duplex', '2', 'Phase-1', 'PLINTH', 4, '2018-03-24', '2018-04-08', '0.00', '164987.70', '0.00', '', '0.00', NULL),
(94, 251, 'H-313', 'Duplex', '2', 'Phase-1', 'GF SLAB', 5, '2018-03-24', '2018-04-08', '0.00', '164987.70', '0.00', '', '0.00', NULL),
(95, 251, 'H-313', 'Duplex', '2', 'Phase-1', 'FF SLAB', 6, '2018-03-24', '2018-04-08', '0.00', '164987.70', '0.00', '', '0.00', NULL),
(96, 251, 'H-313', 'Duplex', '2', 'Phase-1', 'BRICK WORK', 7, '2018-03-24', '2018-04-08', '0.00', '109991.80', '0.00', '', '0.00', NULL),
(97, 251, 'H-313', 'Duplex', '2', 'Phase-1', 'PLASTER WORK', 8, '2018-03-24', '2018-04-08', '0.00', '109991.80', '0.00', '', '0.00', NULL),
(98, 251, 'H-313', 'Duplex', '2', 'Phase-1', 'PAINTING/FINISHING', 9, '2018-03-24', '2018-04-08', '0.00', '54995.90', '0.00', '', '0.00', NULL),
(99, 251, 'H-313', 'Duplex', '2', 'Phase-1', 'POSSESSION', 10, '2018-03-24', '2018-04-08', '1099918.00', '54995.90', '0.00', '', '0.00', '1099918.00'),
(100, 252, 'H-85', 'Duplex', '2', 'Phase-1', 'PLOT REGISTRY', 1, '2018-03-01', '2018-03-16', '2.00', '3481372.89', '2.00', '', '0.00', '3481372.89'),
(101, 252, 'H-85', 'Duplex', '2', 'Phase-1', 'PLOT REGISTRY', 1, '2018-03-09', '2018-03-24', '0.00', '3481372.89', '0.00', '', '0.00', NULL),
(102, 252, 'H-85', 'Duplex', '2', 'Phase-1', 'BOOKING', 2, '2018-03-09', '2018-03-24', '3681372.89', '200000.00', '0.00', '', '0.00', '3681372.89'),
(103, 253, 'H-230', 'Duplex', '2', 'Phase-1', 'PLOT REGISTRY', 1, '2018-03-01', '2018-03-16', '0.00', '3481367.22', '0.00', '', '0.00', '3481367.22'),
(104, 254, 'H-234', 'Duplex', '1', 'Phase-2', 'BOOKING', 1, '2018-03-23', '2018-04-07', '11.00', '381522.75', '11.00', '', '0.00', '381522.75'),
(106, 255, 'H-255', 'Duplex', '2', 'Phase-1', 'PLOT REGISTRY', 1, '2018-03-24', '2018-04-08', '481543.06', '3481543.06', '481543.06', '', '0.00', '3481543.06'),
(107, 256, 'H-255', 'Duplex', '2', 'Phase-1', 'PLOT REGISTRY', 1, '2018-03-24', '2018-04-08', '1259228.47', '1740771.53', '1259228.47', '', '0.00', '1740771.53'),
(108, 257, 'H-256', 'Duplex', '2', 'Phase-1', 'PLOT REGISTRY', 1, '2018-03-24', '2018-04-08', '3481543.06', '3481543.06', '0.00', '', '0.00', '3481543.06'),
(109, 258, 'H-256', 'Duplex', '2', 'Phase-1', 'PLOT REGISTRY', 1, '2018-03-24', '2018-04-08', '1700000.00', '1700000.00', '0.00', '', '0.00', '1700000.00'),
(110, 259, 'H-257', 'Duplex', '2', 'Phase-1', 'PLOT REGISTRY', 1, '2018-03-24', '2018-04-08', '0.00', '1500000.00', '0.00', '', '0.00', '1500000.00'),
(111, 259, 'H-257', 'Duplex', '2', 'Phase-1', 'PLOT REGISTRY', 1, '2018-03-24', '2018-04-08', '0.00', '1500000.00', '0.00', '', '0.00', NULL),
(112, 259, 'H-257', 'Duplex', '2', 'Phase-1', 'BOOKING', 2, '2018-03-24', '2018-04-08', '1650000.00', '150000.00', '0.00', '', '0.00', '1650000.00'),
(119, 261, 'H-82', 'Plot', '1', 'Phase-2', 'Road Development and Surface  Drain Network', 1, '2018-03-23', '2018-04-07', '0.00', '250111.60', '0.00', '', '0.00', '250111.60'),
(121, 261, 'H-82', 'Plot', '1', 'Phase-2', 'Electrical Work', 2, '2018-03-24', '2018-04-08', '0.00', '1250558.00', '0.00', '', '0.00', '1250669.60'),
(122, 261, 'H-82', 'Plot', '1', 'Phase-2', 'Sewer Line Network', 3, '2018-03-24', '2018-04-08', '0.00', '750334.80', '0.00', '', '0.00', '750334.80'),
(123, 261, 'H-82', 'Plot', '1', 'Phase-2', 'Water Supply and Garden Network', 4, '2018-03-23', '2018-04-07', '0.00', '250111.60', '0.00', '', '5.00', '300445.60'),
(124, 264, 'H-235', 'Duplex', '1', 'Phase-2', 'BOOKING', 1, '2018-03-27', '2018-04-11', '0.00', '381522.75', '0.00', '', '0.00', '381522.75'),
(125, 264, 'H-235', 'Duplex', '1', 'Phase-2', 'FOUNDATION', 2, '2018-03-27', '2018-04-11', '0.00', '572284.13', '0.00', '', '0.00', '953806.88'),
(126, 267, 'GF-2', 'Flat', '1', 'Phase-2', 'BOOKING', 1, '2018-03-27', '2018-04-11', '287195.44', '176889.16', '0.00', '', '0.00', '287195.44'),
(127, 269, 'FF-103', 'Flat', '1', 'Phase-2', 'BOOKING', 1, '2018-03-27', '2018-04-11', '0.00', '176889.16', '0.00', '', '0.00', '176889.16');

-- --------------------------------------------------------

--
-- Table structure for table `documents_tbl`
--

CREATE TABLE `documents_tbl` (
  `id` int(11) NOT NULL,
  `applicant_id` int(11) DEFAULT NULL,
  `project_name` varchar(50) CHARACTER SET utf8 COLLATE utf8_unicode_ci DEFAULT NULL,
  `doc_type` varchar(45) CHARACTER SET utf8 COLLATE utf8_unicode_ci DEFAULT NULL,
  `path` varchar(200) CHARACTER SET utf8 COLLATE utf8_unicode_ci DEFAULT NULL,
  `date_of_document` date NOT NULL
) ENGINE=InnoDB DEFAULT CHARSET=utf8;

--
-- Dumping data for table `documents_tbl`
--

INSERT INTO `documents_tbl` (`id`, `applicant_id`, `project_name`, `doc_type`, `path`, `date_of_document`) VALUES
(1, 194, 'ESSARJEE SAMPADA', 'Applicant Allotment Letter', './uploads/uploaded_docs/0_194_ESSARJEE SAMPADA_16-10-2013.pdf', '2013-10-16'),
(4, 208, 'ESSARJEE SAMPADA', 'Applicant Agreement', './uploads/uploaded_docs/0_20180305025501_398219_208_ESSARJEE SAMPADA_05-03-2018.pdf', '2018-03-05'),
(10, 235, 'ESSARJEE SAMPADA', 'Applicant Allotment Letter', './uploads/uploaded_docs/0_20180309010333_93252_235_ESSARJEE SAMPADA_01-02-2018.pdf', '2018-02-01'),
(12, 235, 'ESSARJEE SAMPADA', 'Applicant Agreement', './uploads/uploaded_docs/0_20180309045133_467456_235_ESSARJEE SAMPADA_09-03-2018.pdf', '2018-03-09'),
(13, 237, 'ESSARJEE SAMPADA', 'Applicant Agreement', './uploads/uploaded_docs/0_20180309045214_574500_237_ESSARJEE SAMPADA_09-03-2018.pdf', '2018-03-09'),
(14, 239, 'ESSARJEE SAMPADA', 'Applicant Agreement', './uploads/uploaded_docs/0_20180310010106_188373_239_ESSARJEE SAMPADA_10-03-2018.pdf', '2018-03-10'),
(15, 204, 'ESSARJEE SAMPADA', 'Applicant Agreement', './uploads/uploaded_docs/0_20180310010401_232518_204_ESSARJEE SAMPADA_10-03-2018.pdf', '2018-03-10'),
(16, 242, 'ESSARJEE SAMPADA', 'Applicant Agreement', './uploads/uploaded_docs/0_20180310014848_699337_242_ESSARJEE SAMPADA_01-01-2018.pdf', '2018-01-01'),
(17, 207, 'ESSARJEE SAMPADA', 'Applicant Agreement', './uploads/uploaded_docs/0_20180310045454_639462_207_ESSARJEE SAMPADA_10-03-2018.pdf', '2018-03-10'),
(18, 207, 'ESSARJEE SAMPADA', 'Applicant Allotment Letter', './uploads/uploaded_docs/0_20180310045540_118614_207_ESSARJEE SAMPADA_10-03-2018.pdf', '2018-03-10'),
(19, 208, 'ESSARJEE SAMPADA', 'Applicant Agreement', './uploads/uploaded_docs/Adhar_card_20180322072231_102347_208_ESSARJEE SAMPADA_22-03-2018.pdf', '2018-03-22'),
(20, 208, 'ESSARJEE SAMPADA', 'Co-Applicant-1 PAN', './uploads/uploaded_docs/PAN_20180323053820_415112_208_ESSARJEE SAMPADA_23-03-2018.pdf', '2018-03-23'),
(21, 208, 'ESSARJEE SAMPADA', 'Co-Applicant-2 Voter_id', './uploads/uploaded_docs/Voter_id_20180323053832_985517_208_ESSARJEE SAMPADA_23-03-2018.pdf', '2018-03-23');

-- --------------------------------------------------------

--
-- Table structure for table `doc_title_tbl`
--

CREATE TABLE `doc_title_tbl` (
  `id` int(11) NOT NULL,
  `document_title` varchar(45) COLLATE utf8_unicode_ci NOT NULL
) ENGINE=InnoDB DEFAULT CHARSET=utf8 COLLATE=utf8_unicode_ci;

--
-- Dumping data for table `doc_title_tbl`
--

INSERT INTO `doc_title_tbl` (`id`, `document_title`) VALUES
(51, 'Aadhar Card'),
(52, 'PAN Card'),
(53, 'Voter Id'),
(54, 'Bank statement last six months'),
(55, 'Tax Returns'),
(56, 'Salary Slip three months'),
(57, 'Form sixteen last two year'),
(58, 'Demand Letter'),
(59, 'Allotment Letter'),
(60, 'Agreement'),
(61, 'Affidavit'),
(62, 'Maintenance Agreement'),
(63, 'Possession Set Office Copy'),
(64, 'Possession Set Customer Copy'),
(65, 'Satisfaction Form'),
(66, 'Stamp Value PurposeUndertaking'),
(67, 'Stamp Value PurposeMaintenance Agreement'),
(68, 'Statement of dues I'),
(69, 'Statement of dues II'),
(70, 'Undertaking Form'),
(71, 'Site Inspection Report I'),
(72, 'Site Inspection Report II'),
(73, 'MPEB Affidavit Sampada'),
(74, 'Society Affidavit A'),
(75, 'Society Affidavit B'),
(76, 'NOC mpeb'),
(77, 'Namantaran'),
(78, 'Society Application Sampada'),
(79, 'Society Application Sampada B'),
(80, 'MPEB2');

-- --------------------------------------------------------

--
-- Table structure for table `duplex_category_tbl`
--

CREATE TABLE `duplex_category_tbl` (
  `id` int(11) NOT NULL,
  `category` varchar(20) COLLATE utf8_unicode_ci NOT NULL,
  `ground_floor_area` varchar(50) COLLATE utf8_unicode_ci NOT NULL,
  `first_floor_area` varchar(50) COLLATE utf8_unicode_ci NOT NULL
) ENGINE=InnoDB DEFAULT CHARSET=utf8 COLLATE=utf8_unicode_ci;

-- --------------------------------------------------------

--
-- Table structure for table `facing_tbl`
--

CREATE TABLE `facing_tbl` (
  `id` int(11) NOT NULL,
  `facing` varchar(20) COLLATE utf8_unicode_ci NOT NULL
) ENGINE=InnoDB DEFAULT CHARSET=utf8 COLLATE=utf8_unicode_ci;

--
-- Dumping data for table `facing_tbl`
--

INSERT INTO `facing_tbl` (`id`, `facing`) VALUES
(1, 'East'),
(2, 'GardenFacing');

-- --------------------------------------------------------

--
-- Table structure for table `first_applicant_personal_dtl_tbl`
--

CREATE TABLE `first_applicant_personal_dtl_tbl` (
  `id` int(11) NOT NULL,
  `project_id` varchar(50) COLLATE utf8_unicode_ci NOT NULL,
  `mr_mrs` varchar(20) COLLATE utf8_unicode_ci DEFAULT NULL,
  `name` varchar(30) COLLATE utf8_unicode_ci DEFAULT NULL,
  `fappl_dob` varchar(45) COLLATE utf8_unicode_ci DEFAULT NULL,
  `fappl_age` int(10) DEFAULT NULL,
  `son_doughter_wife` varchar(30) COLLATE utf8_unicode_ci DEFAULT NULL,
  `son_doughter_wife_mr_mrs` varchar(150) COLLATE utf8_unicode_ci DEFAULT NULL,
  `swd_of` varchar(30) COLLATE utf8_unicode_ci DEFAULT NULL,
  `present_addr` varchar(255) COLLATE utf8_unicode_ci DEFAULT NULL,
  `permanent_addr` varchar(255) COLLATE utf8_unicode_ci DEFAULT NULL,
  `pin_code` varchar(20) COLLATE utf8_unicode_ci DEFAULT NULL,
  `contact_mobile` varchar(10) COLLATE utf8_unicode_ci DEFAULT NULL,
  `contact_landline` varchar(10) COLLATE utf8_unicode_ci DEFAULT NULL,
  `email` varchar(45) COLLATE utf8_unicode_ci DEFAULT NULL,
  `aadhar_no` varchar(20) COLLATE utf8_unicode_ci DEFAULT NULL,
  `pan` varchar(20) COLLATE utf8_unicode_ci DEFAULT NULL,
  `qualification` varchar(10) COLLATE utf8_unicode_ci DEFAULT NULL,
  `occupation` varchar(20) COLLATE utf8_unicode_ci DEFAULT NULL,
  `company_name` varchar(50) COLLATE utf8_unicode_ci DEFAULT NULL,
  `appl_doj` varchar(45) COLLATE utf8_unicode_ci DEFAULT NULL,
  `appl_desig` varchar(50) COLLATE utf8_unicode_ci DEFAULT NULL,
  `appl_dept` varchar(50) COLLATE utf8_unicode_ci DEFAULT NULL,
  `appl_monthly_income` varchar(10) COLLATE utf8_unicode_ci DEFAULT NULL,
  `fa_empl_addr` varchar(150) COLLATE utf8_unicode_ci DEFAULT NULL,
  `pin_code_emp` varchar(40) COLLATE utf8_unicode_ci DEFAULT NULL,
  `earning_members` varchar(4) COLLATE utf8_unicode_ci DEFAULT NULL,
  `no_of_dependent` int(4) DEFAULT NULL,
  `dependents_details` text COLLATE utf8_unicode_ci,
  `solo_coowner` varchar(20) COLLATE utf8_unicode_ci DEFAULT NULL,
  `loan_reqs` varchar(10) COLLATE utf8_unicode_ci DEFAULT NULL,
  `amt_of_loan` int(10) DEFAULT NULL,
  `bank_name` varchar(50) COLLATE utf8_unicode_ci DEFAULT NULL,
  `acc_no` varchar(20) COLLATE utf8_unicode_ci DEFAULT NULL,
  `mode_of_payment` varchar(50) COLLATE utf8_unicode_ci DEFAULT NULL,
  `booking_amt` int(10) DEFAULT NULL,
  `cheque_no` varchar(100) COLLATE utf8_unicode_ci DEFAULT NULL,
  `cheque_dt` varchar(45) COLLATE utf8_unicode_ci DEFAULT NULL,
  `img_path` varchar(150) COLLATE utf8_unicode_ci DEFAULT NULL,
  `date` date NOT NULL,
  `fappl_documents` varchar(500) COLLATE utf8_unicode_ci DEFAULT NULL,
  `additional_info` varchar(150) COLLATE utf8_unicode_ci DEFAULT NULL,
  `parking_type` varchar(30) COLLATE utf8_unicode_ci NOT NULL,
  `pre_salesid` int(11) NOT NULL,
  `login_id` varchar(11) COLLATE utf8_unicode_ci NOT NULL,
  `is_complete` tinyint(1) NOT NULL DEFAULT '0',
  `intrest_rate` decimal(10,2) NOT NULL
) ENGINE=InnoDB DEFAULT CHARSET=utf8 COLLATE=utf8_unicode_ci;

--
-- Dumping data for table `first_applicant_personal_dtl_tbl`
--

INSERT INTO `first_applicant_personal_dtl_tbl` (`id`, `project_id`, `mr_mrs`, `name`, `fappl_dob`, `fappl_age`, `son_doughter_wife`, `son_doughter_wife_mr_mrs`, `swd_of`, `present_addr`, `permanent_addr`, `pin_code`, `contact_mobile`, `contact_landline`, `email`, `aadhar_no`, `pan`, `qualification`, `occupation`, `company_name`, `appl_doj`, `appl_desig`, `appl_dept`, `appl_monthly_income`, `fa_empl_addr`, `pin_code_emp`, `earning_members`, `no_of_dependent`, `dependents_details`, `solo_coowner`, `loan_reqs`, `amt_of_loan`, `bank_name`, `acc_no`, `mode_of_payment`, `booking_amt`, `cheque_no`, `cheque_dt`, `img_path`, `date`, `fappl_documents`, `additional_info`, `parking_type`, `pre_salesid`, `login_id`, `is_complete`, `intrest_rate`) VALUES
(192, '1', NULL, NULL, NULL, 0, '', '', '', NULL, NULL, '', NULL, '', 'bn@bn.bn', '', '', '', 'Others', '', '', '', '', '', '', '', '', 0, '', '', '', 0, '', '', NULL, 0, '', '', NULL, '0000-00-00', '', '', '', 0, '', 0, '0.00'),
(193, '1', NULL, 'Raman', NULL, NULL, NULL, NULL, NULL, NULL, NULL, NULL, NULL, NULL, NULL, NULL, NULL, NULL, NULL, NULL, NULL, NULL, NULL, NULL, NULL, NULL, NULL, NULL, NULL, NULL, NULL, NULL, NULL, NULL, NULL, NULL, NULL, NULL, NULL, '0000-00-00', NULL, NULL, '', 1, '', 0, '0.00'),
(194, '2', 'Mr.', 'Rohit Kumar Malviya', '04-05-1985', 32, 'S/o', 'Mr.', 'Ramesh Chandra Malviya', '545/D-3/A-sector/,Piplani, BHEL, Bhopal', '545/D-3/A-sector/,Piplani, BHEL, Bhopal', '', '8959182002', '', 'ashwin.j@ogatechnologies.com', '', '', 'Graduate', 'Service', 'BHEL Bhopal', '04-02-2010', 'Asst. Grade III', 'FHX Maintainance', '', 'BHEL Bhopal', '', '1', 2, 'Smt. Yashoda Malviya(wife),Rudraksh Malviya (son)', 'Sole-Owner', 'Yes', 0, '', '', 'Cheque', 0, '', '', './uploads/applicants_img/', '2018-02-27', 'Adhar_card,', '', '', 3, '336', 1, '0.00'),
(195, '2', 'Mr.', 'Duplex Raja', '12-02-1980', 38, 'S/o', 'Mr.', 'Champak', 'bhopal', 'bhopal', '', '9876543215', '', 'ashwin.j@ogatechnologies.com', '', '', '', 'Service', '', '', '', '', '', '', '', '', 0, '', '', '', 0, '', '', 'Cheque', 0, '', '', './uploads/applicants_img/', '2018-02-27', '', '', '', 4, '335', 1, '0.00'),
(196, '2', 'Mr.', 'Abhishek Pandey', '03-02-1987', 31, 'S/o.', 'Mr.', 'Anuj Pandey', 'bhopal', 'bhopal', '462008', '9685745634', NULL, 'ashwin.j@ogatechnologies.com', '', '', '', 'Service', '', '', '', '', '0.00', '', '', '', 0, '', '', '', 0, '', '', 'Cheque', 10000, '362541', '27-02-2018', './uploads/applicants_img/Arafat201802270411201519728080ESSARJEE SAMPADA.jpg', '2018-02-27', 'Aadhar Card,', '', '', 5, '335', 1, '0.00'),
(197, '1', 'Mr.', 'Iram Khan', '09-05-1984', 33, 'S/o.', 'Mr.', 'Farhook Khan', 'bhopal', 'bhopal', '365241', '9685743654', NULL, 'ashwin.j@ogatechnologies.com', '231456987414', 'AAAAA1234Q', '', 'Service', '', '', '', '', '0.00', '', '', '', 0, '', '', '', 0, '', '', 'Cheque', 10000, '362514', '27-02-2018', './uploads/applicants_img/Arafat201802270510211519731621ESSARJEE SAMPADA.jpg', '2018-02-27', '', '', '', 6, '335', 1, '0.00'),
(198, '1', 'Mr.', 'Pankaj Kumar Jha ', '08-02-1956', 62, '', '', '', 'jgjg', 'jgjg', '', '9898989898', '', 'nirbhayc4@gmail.com', '', '', '', 'None', '', '', '', '', '', '', '', '', 0, '', '', '', 0, '', '', 'Cheque', 0, '', '', './uploads/applicants_img/', '2018-02-28', '', '', '', 7, '335', 1, '0.00'),
(199, '1', 'Mrs.', 'Shreedevi', '02-02-1999', 19, '', '', '', 'bpl', 'bpl', '', '8871887109', '', 'nmalviya575@gmail.com', '', '', '', 'Others', '', '', '', '', '', '', '', '', 0, '', '', '', 0, '', '', 'Cheque', 0, '', '', './uploads/applicants_img/', '2018-02-28', '', '', '', 8, '335', 1, '0.00'),
(200, '1', 'Mr.', 'Ranjan Shah', '03-02-1955', 63, '', '', '', 'gfg', 'gfg', '', '8787878787', '', 'nirbhayc4@gmail.com', '', '', '', 'None', '', '', '', '', '', '', '', '', 0, '', '', '', 0, '', '', 'Cheque', 0, '', '', './uploads/applicants_img/', '2018-02-28', '', '', '', 9, '335', 1, '0.00'),
(201, '2', 'Mr.', 'Phaseone Duplex', '11-02-1985', 33, '', '', '', 'Gwalior', 'Gwalior', '462043', '9876543215', '', 'ashwin.j@ogatechnologies.com', '', '', '', 'Service', '', '', '', '', '', '', '', '', 0, '', '', '', 0, '', '', 'Cheque', 0, '', '', './uploads/applicants_img/', '2018-02-28', '', '', '', 10, '335', 1, '0.00'),
(202, '1', 'Mr.', 'Lokesh ', '14-02-1957', 61, 'S/o.', 'Ms.', 'dolat ram', '256/shahpura bhopal', 'gdg', '462030', '8989898989', NULL, 'nirbhayc4@gmail.com', '', '', '', 'None', '', '', '', '', '0.00', '', '', '', 0, '', '', '', 0, '', '', 'Cheque', 51000, '55656', '03-03-2018', './uploads/applicants_img/', '2018-02-28', '', '', '', 13, '335', 1, '0.00'),
(203, '1', 'Mr.', 'Phasetwo Flat', '10-03-1988', 29, 'S/o', 'Mr.', 'Champak', 'Gwalior', 'Gwalior', '', '9865325696', '', 'ashwin.j@ogatechnologies.com', '', '', '', 'Service', '', '', '', '', '', '', '', '', 0, '', '', '', 0, '', '', 'Cheque', 0, '', '', './uploads/applicants_img/', '2018-03-01', '', '', '', 16, '335', 1, '0.00'),
(204, '1', 'Mr.', 'Usha kumari', '13-03-1958', 59, '', '', '', 'line no 205 ,near railway station road, 80 fit road, naveen nagar bhopal ', 'line no 205 ,near railway station road, 80 fit road, naveen nagar bhopal ', '', '8989898989', NULL, 'nirbhayc4@gmail.com', '', '', '', 'None', '', '', '', '', '0.00', '', '', '', 0, '', '', '', 0, '', '', 'Cheque', 0, '', '', './uploads/applicants_img/1446288359201803230121281521791488ESSARJEE SAMPADA.jpg', '2018-03-03', '', '', '', 18, '335', 1, '0.00'),
(205, '2', 'Mr.', 'Vinay Kumar', '13-03-1958', 59, '', '', '', 'bgdb', 'bgdb', '', '8977979779', '', 'nirbhayc4@gmail.com', '', '', '', 'None', '', '', '', '', '', '', '', '', 0, '', '', '', 0, '', '', 'Cheque', 0, '', '', './uploads/applicants_img/', '2018-03-03', '', '', '', 19, '335', 1, '0.00'),
(207, '2', 'Mr.', 'Phaseone Duplex', '18-03-1982', 35, 'S/o.', 'Mr.', 'Nandu Bhaiya', 'Bhopal', 'Bhopal', '', '9845965874', NULL, 'ashwin.j@ogatechnologies.com', '', '', '', 'Service', '', '', '', '', '0.00', '', '', '', 0, '', '', '', 0, '', '', 'Cheque', 0, '', '', './uploads/applicants_img/abc201803051144491520230489ESSARJEE SAMPADA.jpeg', '2018-03-05', 'PAN Card,', '', '', 23, '335', 1, '0.00'),
(208, '2', 'Mr.', 'Phaseone Duplex Two', '11-03-1982', 35, 'S/o.', 'Mr.', 'Champak Bhaiya', 'Gwalior', 'Gwalior', '', '9425790662', NULL, 'ashwin.j@ogatechnologies.com', '', '', '', 'Business', '', '', '', '', '0.00', '', '', '', 0, '', '', '', 0, '', '', 'Cheque', 0, '', '', './uploads/applicants_img/Blue_backgrounda201803230440201521803420ESSARJEE SAMPADA.307194417_std', '2018-03-05', '', '', '', 25, '335', 1, '0.00'),
(209, '2', NULL, 'Dolly Patel', NULL, NULL, NULL, NULL, NULL, NULL, NULL, NULL, NULL, NULL, NULL, NULL, NULL, NULL, NULL, NULL, NULL, NULL, NULL, NULL, NULL, NULL, NULL, NULL, NULL, NULL, NULL, NULL, NULL, NULL, NULL, NULL, NULL, NULL, NULL, '0000-00-00', NULL, NULL, '', 28, '', 0, '0.00'),
(210, '1', NULL, 'Aditi Patel', NULL, NULL, NULL, NULL, NULL, NULL, NULL, NULL, NULL, NULL, NULL, NULL, NULL, NULL, NULL, NULL, NULL, NULL, NULL, NULL, NULL, NULL, NULL, NULL, NULL, NULL, NULL, NULL, NULL, NULL, NULL, NULL, NULL, NULL, NULL, '0000-00-00', NULL, NULL, '', 24, '', 0, '0.00'),
(211, '2', NULL, 'Ayushi Bhadoriya', NULL, NULL, NULL, NULL, NULL, NULL, NULL, NULL, NULL, NULL, NULL, NULL, NULL, NULL, NULL, NULL, NULL, NULL, NULL, NULL, NULL, NULL, NULL, NULL, NULL, NULL, NULL, NULL, NULL, NULL, NULL, NULL, NULL, NULL, NULL, '0000-00-00', NULL, NULL, '', 27, '', 0, '0.00'),
(212, '2', NULL, 'Ayushi Bhadoriya', NULL, NULL, NULL, NULL, NULL, NULL, NULL, NULL, NULL, NULL, NULL, NULL, NULL, NULL, NULL, NULL, NULL, NULL, NULL, NULL, NULL, NULL, NULL, NULL, NULL, NULL, NULL, NULL, NULL, NULL, NULL, NULL, NULL, NULL, NULL, '0000-00-00', NULL, NULL, '', 27, '', 0, '0.00'),
(213, '2', NULL, 'Krishna Malviya', NULL, NULL, NULL, NULL, NULL, NULL, NULL, NULL, NULL, NULL, NULL, NULL, NULL, NULL, NULL, NULL, NULL, NULL, NULL, NULL, NULL, NULL, NULL, NULL, NULL, NULL, NULL, NULL, NULL, NULL, NULL, NULL, NULL, NULL, NULL, '0000-00-00', NULL, NULL, '', 29, '', 0, '0.00'),
(214, '2', NULL, 'Preeti', NULL, NULL, NULL, NULL, NULL, NULL, NULL, NULL, NULL, NULL, NULL, NULL, NULL, NULL, NULL, NULL, NULL, NULL, NULL, NULL, NULL, NULL, NULL, NULL, NULL, NULL, NULL, NULL, NULL, NULL, NULL, NULL, NULL, NULL, NULL, '0000-00-00', NULL, NULL, '', 31, '', 0, '0.00'),
(215, '2', NULL, 'Shikha Singh', NULL, NULL, NULL, NULL, NULL, NULL, NULL, NULL, NULL, NULL, NULL, NULL, NULL, NULL, NULL, NULL, NULL, NULL, NULL, NULL, NULL, NULL, NULL, NULL, NULL, NULL, NULL, NULL, NULL, NULL, NULL, NULL, NULL, NULL, NULL, '0000-00-00', NULL, NULL, '', 33, '', 0, '0.00'),
(216, '2', NULL, 'Shikha Singh', NULL, NULL, NULL, NULL, NULL, NULL, NULL, NULL, NULL, NULL, NULL, NULL, NULL, NULL, NULL, NULL, NULL, NULL, NULL, NULL, NULL, NULL, NULL, NULL, NULL, NULL, NULL, NULL, NULL, NULL, NULL, NULL, NULL, NULL, NULL, '0000-00-00', NULL, NULL, '', 33, '', 0, '0.00'),
(217, '2', 'Mr.', 'Rohan', '08-03-1978', 39, 'S/o.', 'Mr.', 'Ankur', 'bhopal', 'bhopal', '362514', '7878787878', NULL, 'stanu765@gmail.com', '968574142536', 'AWERD1234Q', 'mba', 'Service', 'bhel', '', 'officer', 'IT', '0.00', 'govindpura,bhopal', '123654', '', 0, '', '', '', 0, 'SBI', '', 'Cheque', 10000, '362514', '07-03-2018', './uploads/applicants_img/male_img201803070647291520405249ESSARJEE SAMPADA.jpg', '2018-03-07', '', '', '', 34, '335', 1, '0.00'),
(218, '2', NULL, 'Priyanka Rajput', NULL, NULL, NULL, NULL, NULL, NULL, NULL, NULL, NULL, NULL, NULL, NULL, NULL, NULL, NULL, NULL, NULL, NULL, NULL, NULL, NULL, NULL, NULL, NULL, NULL, NULL, NULL, NULL, NULL, NULL, NULL, NULL, NULL, NULL, NULL, '0000-00-00', NULL, NULL, '', 35, '', 0, '0.00'),
(219, '2', 'Mr.', 'Abrahim', '05-03-1990', 28, 'S/o.', 'Mr.', 'Abdul Zaffar', 'bhopal', 'bhopal', '456123', '9685741236', NULL, 'stanu765@gmail.com', '362514789456', 'ASWER3456k', 'MCA', 'Others', 'HCL', '', 'IT Head', 'IT', '0.00', 'thane, mumbai', '968574', '', 0, '', '', '', 0, 'SBI', '', 'Cheque', 10000, '321456', '06-03-2018', './uploads/applicants_img/pan_card_female_img201803070608061520402886ESSARJEE SAMPADA.jpg', '2018-03-07', '', '', '', 36, '335', 1, '0.00'),
(220, '1', 'Mr.', 'Raaj Sahu', '06-03-1979', 39, 'S/o.', 'Mr.', 'Anmol', 'bhopal', 'bhopal', '451263', '9874561235', NULL, 'stanu765@gmail.com', '968574123654', 'AQWSE1234W', 'bba', 'Service', 'techsoft', '', 'sm', 'sales', '0.00', 'mpnagar bhopal', '897456', '', 0, '', '', '', 0, 'SBI', '', 'Cheque', 10000, '362514', '07-03-2018', './uploads/applicants_img/ramu7201803071249511520407191ESSARJEE SAMPADA.jpg', '2018-03-07', '', '', '', 37, '335', 1, '0.00'),
(221, '1', NULL, 'Ankul', NULL, NULL, NULL, NULL, NULL, NULL, NULL, NULL, NULL, NULL, NULL, NULL, NULL, NULL, NULL, NULL, NULL, NULL, NULL, NULL, NULL, NULL, NULL, NULL, NULL, NULL, NULL, NULL, NULL, NULL, NULL, NULL, NULL, NULL, NULL, '0000-00-00', NULL, NULL, '', 38, '', 0, '0.00'),
(222, '1', 'Mr.', 'Waseem', '07-03-1972', 45, 'S/o', 'Mr.', 'Khaalid', 'bhopal', 'bhopal', '362514', '9856231475', '', 'stanu765@gmail.com', '369258741753', 'FGHDS1234W', 'mba', 'Service', 'isonic', '', 'office assistant', 'Back office', '', 'DLF sez unit , thane mumbai', '365241', '', 0, '', '', '', 0, 'ICICI', '', 'Cheque', 10000, '002136', '07-03-2018', './uploads/applicants_img/ramu7201803070245331520414133ESSARJEE SAMPADA.jpg', '2018-03-07', 'PAN,Adhar_card,', '', '', 41, '335', 1, '0.00'),
(223, '2', NULL, 'Rohan', NULL, NULL, NULL, NULL, NULL, NULL, NULL, NULL, NULL, NULL, NULL, NULL, NULL, NULL, NULL, NULL, NULL, NULL, NULL, NULL, NULL, NULL, NULL, NULL, NULL, NULL, NULL, NULL, NULL, NULL, NULL, NULL, NULL, NULL, NULL, '0000-00-00', NULL, NULL, '', 34, '', 0, '0.00'),
(224, '1', NULL, 'Gunjan Kumar ', NULL, NULL, NULL, NULL, NULL, NULL, NULL, NULL, NULL, NULL, NULL, NULL, NULL, NULL, NULL, NULL, NULL, NULL, NULL, NULL, NULL, NULL, NULL, NULL, NULL, NULL, NULL, NULL, NULL, NULL, NULL, NULL, NULL, NULL, NULL, '0000-00-00', NULL, NULL, '', 42, '', 0, '0.00'),
(226, '1', 'Mr.', 'Yash Kumar', '09-03-1978', 39, 'S/o', 'Mr.', 'Ashok ', 'bhopal', 'bhopal', '', '8978787878', '', 'nirbhayc4@gmail.com', '', '', '', 'None', '', '', '', '', '', '', '', '', 0, '', '', '', 0, '', '', 'Cheque', 0, '', '', './uploads/applicants_img/', '2018-03-07', '', '', '', 44, '335', 1, '0.00'),
(227, '1', 'Mr.', 'THULLU RAM', '07-03-1984', 33, 'S/o', 'Mr.', 'Jai Kumar', 'Bhopal', 'Bhopal', '', '9638521478', '', 'ashwin.j@ogatechnologies.com', '', '', '', 'Service', '', '', '', '', '', '', '', '', 0, '', '', '', 0, '', '', 'Cheque', 0, '', '', './uploads/applicants_img/', '2018-03-07', '', '', '', 45, '335', 1, '0.00'),
(228, '1', NULL, 'Rahul Mahajan ', NULL, NULL, NULL, NULL, NULL, NULL, NULL, NULL, NULL, NULL, NULL, NULL, NULL, NULL, NULL, NULL, NULL, NULL, NULL, NULL, NULL, NULL, NULL, NULL, NULL, NULL, NULL, NULL, NULL, NULL, NULL, NULL, NULL, NULL, NULL, '0000-00-00', NULL, NULL, '', 46, '', 0, '0.00'),
(229, '1', 'Mr.', 'Rakesh Sharma Rahul Raj ', '12-03-1993', 24, 'S/o', 'Mr.', 'Moolchand Sharma', '18  A Sainik colony', '18  A Sainik colony', '462030', '8817448282', '', 'ritesh.ramchandani3@gmail.com', '787971173023', 'ADRFG4569V', 'MCA', 'Business', '', '', '', '', '100000', '', '', '4', 1, 'Rohan', 'Sole-Owner', 'No', 0, 'SBI', '15002036987', 'Cash', 20000, '', '08-03-2018', './uploads/applicants_img/', '2018-03-08', 'PAN,Adhar_card,Voter_id,Bank_statement,', '', '', 47, '335', 1, '0.00'),
(230, '1', NULL, 'Aarti', NULL, NULL, NULL, NULL, NULL, NULL, NULL, NULL, NULL, NULL, NULL, NULL, NULL, NULL, NULL, NULL, NULL, NULL, NULL, NULL, NULL, NULL, NULL, NULL, NULL, NULL, NULL, NULL, NULL, NULL, NULL, NULL, NULL, NULL, NULL, '0000-00-00', NULL, NULL, '', 48, '', 0, '0.00'),
(231, '1', 'Ms.', 'Farha', '12-03-1968', 49, 'D/o', 'Mr.', 'Farhan', 'bhopal', 'bhopal', '123654', '9876543251', '', 'stanu765@gmail.com', '', '', '', 'Service', '', '', '', '', '', '', '', '', 0, '', '', '', 0, '', '', 'Cheque', 0, '', '', './uploads/applicants_img/', '2018-03-08', '', '', '', 49, '335', 1, '0.00'),
(232, '2', 'Mr.', 'Ram', '09-03-1965', 52, 'S/o', 'Mr.', 'Sitaram', 'bhopal', 'bhopal', '', '9856471236', '', 'stanu765@gmail.com', '', '', '', 'Others', '', '', '', '', '', '', '', '', 0, '', '', '', 0, '', '', 'Cheque', 0, '', '', './uploads/applicants_img/', '2018-03-08', '', '', '', 50, '335', 1, '0.00'),
(234, '1', 'Mr.', 'Lenovo', '04-03-1993', 25, 'S/o', 'Mr.', 'Dell', 'Delhi', 'Delhi', '', '8878779898', '', 'ritesh.ramchandani3@gmail.com', '', '', '', 'Service', '', '', '', '', '', '', '', '', 0, '', '', '', 0, '', '', 'Cheque', 0, '', '', './uploads/applicants_img/', '2018-03-08', '', '', '', 52, '335', 1, '0.00'),
(235, '1', 'Mr.', 'Mohit Advani Duplex', '12-03-1993', 24, 'S/o.', 'Mr.', 'Moolchand', 'Zone 1 mp nagar Bhopal', 'Zone 1 mp nagar Bhopal', '462030', '8871887109', NULL, 'ritesh.ramchandani3@gmail.com', '787971173023', 'AERGH5656F', 'MCA', 'Service', 'TCS', '09-03-2018', 'Developer', 'Information Technology', '50000.00', 'Zone 1 Mpnagar', '462011', '4', 0, '', 'Sole-Owner', 'Yes', 1000000, 'SBi', '35522196738', 'Cash', 20000, '', '09-03-2018', './uploads/applicants_img/', '2018-03-09', '', '', '', 53, '335', 1, '0.00'),
(236, '1', 'Mr.', 'Vicky Ramchandani Flat ', '10-03-1988', 29, 'S/o', '', 'Govind Ramchandani', 'Lakshman nagar bairagarh', 'Lakshman nagar bairagarh', '462030', '8871887109', '', 'vickey.ramchandani3@gmail.com', '454789635236', 'AWERF4569D', 'MCA', 'Service', 'Globas Pvt limited', '09-03-2018', 'Marketing Head ', 'Sales', '50000', 'Zone 1 Mp nagar', '462030', '4', 3, 'Ritesh , nitesh', 'Sole-Owner', 'Yes', 200000, 'SBI', '365522196738', 'Cash', 20000, '', '09-03-2018', './uploads/applicants_img/', '2018-03-09', 'PAN,Adhar_card,Voter_id,Bank_statement,Income Tax return last 3 year,Salary_slip,photo,form,', 'all documents submited ', '', 54, '335', 1, '0.00'),
(237, '1', 'Mr.', 'Sumit ', '03-03-1988', 30, 'S/o', 'Mr.', 'Seenu ', 'Bhopal', 'Bhopal', '462030', '8871887109', '', 'nmalviya575@gmail.com', '787971173012', 'awedr5645f', 'mca', 'Service', 'OGA', '09-03-2018', 'DEVELOPER', 'development', '20000', 'Bhopal', '462030', '4', 2, 'ritesh, nitesh', 'Sole-Owner', 'No', 0, 'SBI', '35522196735', 'Cash', 20000, '', '09-03-2018', './uploads/applicants_img/', '2018-03-09', 'PAN,Adhar_card,Voter_id,Bank_statement,Income Tax return last 3 year,Salary_slip,', 'all checked ', '', 55, '335', 1, '0.00'),
(238, '1', NULL, 'Phasetwo Flat', NULL, NULL, NULL, NULL, NULL, NULL, NULL, NULL, NULL, NULL, NULL, NULL, NULL, NULL, NULL, NULL, NULL, NULL, NULL, NULL, NULL, NULL, NULL, NULL, NULL, NULL, NULL, NULL, NULL, NULL, NULL, NULL, NULL, NULL, NULL, '0000-00-00', NULL, NULL, '', 56, '', 0, '0.00'),
(239, '1', 'Mr.', 'Rohit Malviya', '08-03-1996', 22, 'S/o', 'Mr.', 'M Malviya', 'bhopal', 'bhopal', '462030', '8871887109', '', 'nmalviya575@gmail.com', '', '', '', 'Service', '', '', '', '', '', '', '', '', 0, '', '', '', 0, '', '', 'Cash', 12000, '', '', './uploads/applicants_img/', '2018-03-09', '', '', '', 57, '335', 1, '0.00'),
(240, '1', 'Mr.', 'Veerendra Chouhan ', '19-02-1993', 25, '', '', '', 'BHOPAL', 'BHOPAL', '462030', '8871887109', '', 'nmalviya575@gmail.com', '', '', '', 'Service', '', '', '', '', '', '', '', '', 0, '', '', '', 0, '', '', 'Cheque', 0, '', '', './uploads/applicants_img/', '2018-03-09', '', '', '', 58, '335', 1, '0.00'),
(241, '2', NULL, 'Nikita Chimlani', NULL, NULL, NULL, NULL, NULL, NULL, NULL, NULL, NULL, NULL, NULL, NULL, NULL, NULL, NULL, NULL, NULL, NULL, NULL, NULL, NULL, NULL, NULL, NULL, NULL, NULL, NULL, NULL, NULL, NULL, NULL, NULL, NULL, NULL, NULL, '0000-00-00', NULL, NULL, '', 60, '', 0, '0.00'),
(242, '1', 'Mr.', 'Ews Phasetwo Flat', '05-03-1985', 33, '', '', '', 'Bhopal', 'Bhopal', '', '9865326985', '', 'ajjuwekar@gmail.com', '', '', '', 'Service', '', '', '', '', '', '', '', '', 0, '', '', '', 0, '', '', 'Cheque', 0, '', '', './uploads/applicants_img/', '2018-03-10', '', '', '', 61, '335', 1, '0.00'),
(243, '1', 'Mr.', 'LIG Phasetwo Flat', '16-03-1978', 39, '', '', '', 'Bhopal', 'Bhopal', '', '9875652586', '', 'ajjuwekar@gmail.com', '', '', '', 'Service', '', '', '', '', '', '', '', '', 0, '', '', '', 0, '', '', 'Cheque', 0, '', '', './uploads/applicants_img/', '2018-03-10', '', '', '', 62, '335', 1, '0.00'),
(244, '1', 'Mr.', 'Phase Two Shop', '12-03-1950', 67, 'S/o', 'Mr.', 'Phase One ', 'Bhopal', 'Bhopal', '', '8871887109', '', 'nmalviya575@gmail.com', '787971173012', 'BBBBT4563F', '', 'Service', '', '', '', '', '', '', '', '', 0, '', '', '', 0, '', '', 'Cheque', 0, '', '', './uploads/applicants_img/', '2018-03-10', '', '', '', 64, '335', 1, '0.00'),
(245, '1', 'Mr.', 'Phase Two Plot', '21-03-1997', 20, '', '', '', 'Bhopal', 'Bhopal', '462030', '8817448282', '', 'nmalviya575@gmail.com', '', '', '', 'Service', '', '', '', '', '', '', '', '', 0, '', '', '', 0, '', '', 'Cheque', 0, '', '', './uploads/applicants_img/', '2018-03-10', '', '', '', 65, '335', 1, '0.00'),
(246, '1', NULL, 'Phase Two Plot', NULL, NULL, NULL, NULL, NULL, NULL, NULL, NULL, NULL, NULL, NULL, NULL, NULL, NULL, NULL, NULL, NULL, NULL, NULL, NULL, NULL, NULL, NULL, NULL, NULL, NULL, NULL, NULL, NULL, NULL, NULL, NULL, NULL, NULL, NULL, '0000-00-00', NULL, NULL, '', 66, '', 0, '0.00'),
(247, '1', 'Mr.', 'Yati', '21-03-1963', 54, '', '', '', 'ssdfs', 'klhjkl', '', '7787878787', '', 'nirbhayc4@gmail.com', '', '', '', 'None', '', '', '', '', '', '', '', '', 0, '', '', '', 0, '', '', 'Cheque', 0, '', '', './uploads/applicants_img/', '2018-03-10', '', '', '', 67, '335', 1, '0.00'),
(248, '1', NULL, 'Avni', NULL, NULL, NULL, NULL, NULL, NULL, NULL, NULL, NULL, NULL, NULL, NULL, NULL, NULL, NULL, NULL, NULL, NULL, NULL, NULL, NULL, NULL, NULL, NULL, NULL, NULL, NULL, NULL, NULL, NULL, NULL, NULL, NULL, NULL, NULL, '0000-00-00', NULL, NULL, '', 68, '', 0, '0.00'),
(249, '1', 'Mr.', 'Veena Gyanchandani', '14-03-1991', 26, 'S/o', 'Mr.', 'Moolchand', 'bhopal', 'bhopal', '462030', '8878778989', '', 'nmalviy@gmail.com', '', '', '', 'Business', '', '', '', '', '', '', '', '', 0, '', '', '', 0, '', '', 'Cheque', 0, '', '', './uploads/applicants_img/', '2018-03-10', '', '', '', 69, '335', 1, '0.00'),
(250, '2', 'Ms.', 'Manisha Rajput', '02-03-1999', 19, 'D/o', 'Mr.', 'Nitin Rajput', 'Bhopal', 'Bhopal', '', '8871887109', '', 'nmalviya575@gmail.com', '', '', '', 'Others', '', '', '', '', '', '', '', '', 0, '', '', '', 0, '', '', 'Cheque', 0, '', '', './uploads/applicants_img/NAFISA1201803211032241521624744ESSARJEE SAMPADA.jpg', '2018-03-21', '', '', '', 78, '335', 1, '0.00'),
(251, '2', '', 'Ashwin Sir', '08-03-1990', 28, '', '', '', 'hh', 'hh', '', '8871887109', '', 'nirbhayc4@gmail.com', '', '', '', 'Service', '', '', '', '', '', '', '', '', 0, '', '', '', 0, '', '', 'Cheque', 0, '', '', './uploads/applicants_img/', '2018-03-22', '', '', '', 81, '335', 1, '0.00'),
(252, '2', 'Mr.', 'Phase One Duplex Updated', '04-03-1987', 31, 'S/o', 'Mr.', 'Champak', 'Bhopal', 'Bhopal', '', '9856989689', '', 'ajjuwekar@gmail.com', '', '', '', 'Service', '', '', '', '', '', '', '', '', 0, '', '', '', 0, '', '', 'Cheque', 0, '', '', './uploads/applicants_img/', '2018-03-22', '', '', '', 84, '335', 1, '0.00'),
(253, '2', 'Mr.', 'Phase One Duplex Two', '05-03-1970', 48, 'S/o.', 'Mr.', 'Jolly', 'Bhopal', 'Bhopal', '985696', '9865985696', NULL, 'ajjuwekar@gmail.com', '458796377373', '', '', 'Service', '', '', '', '', '0.00', '', '', '', 0, '', '', '', 0, '', '', 'Cheque', 0, '', '', './uploads/applicants_img/', '2018-03-22', '', '', '', 85, '335', 1, '0.00'),
(254, '1', 'Mr.', 'Nirbhay Singh Chouhan', '18-03-1993', 25, 'S/o', 'Mr.', 'Ashok Chouhan', '18 A sainik colony Tward Bairagarh ', '18 A sainik colony Tward Bairagarh ', '462030', '8817448282', '', 'ritesh.ramchandani3@gmail.com', '787971173012', 'BBBBD4562D', 'MCA', 'Service', 'Oga Technologies.com', '23-03-2018', 'sales', 'sales', '50000', 'Zone2', '462030', '4', 2, 'Rohit, Ramchandani', 'Sole-Owner', 'Yes', 50000, 'SBI', '7879711023', 'Cash', 2000, '', '23-03-2018', './uploads/applicants_img/Rahul201803230722471521813167ESSARJEE SAMPADA.jpg', '2018-03-23', 'Adhar_card,Voter_id,Bank_statement,Income Tax return last 3 year,Salary_slip,photo,', '', '', 87, '335', 1, '0.00'),
(255, '2', 'Mr.', 'NULL', '12-03-1994', 24, 'S/o.', 'Mr.', 'Vineet Sharma', 'Mp nagar Zone-1 Bhopal Near ICICI Bank', 'Mp nagar Zone-1 Bhopal Near ICICI Bank', '462030', '8817448282', NULL, 'sharma.shrinkhla@gmail.com', '355221963523', 'BIHET4589B', 'MCA', 'Service', 'IBM', '12-03-1993', 'Software Developer', 'Information Technology ', '30000.00', 'Manyata Bangalore', '462030', '4', 0, '', 'Sole-Owner', 'Yes', 100000, 'SBI', '35522196738', 'Cash', 20000, '', '24-03-2018', './uploads/applicants_img/Paayal201803240103121521876792ESSARJEE SAMPADA.jpg', '2018-03-24', '', 'All Information is given properly', '', 0, '335', 1, '0.00'),
(256, '2', 'Mr.', 'Shrinkhla Sharma', '12-03-1993', 25, 'S/o', 'Mr.', 'Vinay Sharma', 'Zone 1 lower groundfloor Manyata Bangalore', 'Zone 1 lower groundfloor Manyata Bangalore', '462030', '8817448282', '', 'nmalviya575@gmail.com', '787896656989', 'BTYHU4565B', 'MCA', 'Service', 'IBM', '22-03-2018', 'Developer', 'Information Technology', '50000', 'zone 1 MP nagar', '462030', '4', 0, '', 'Sole-Owner', 'Yes', 100000, 'SBI', '35522196738', 'Cheque', 20000, '4586', '24-03-2018', './uploads/applicants_img/Paayal201803240407261521887846ESSARJEE SAMPADA.jpg', '2018-03-24', 'PAN,Adhar_card,Voter_id,Bank_statement,Income Tax return last 3 year,Salary_slip,photo,form,', '', '', 88, '335', 1, '0.00'),
(257, '2', 'Mr.', 'NULL', '18-03-1993', 25, 'S/o', 'Mr.', 'Alok Upadhyay ', 'Bhopal', 'Bhopal', '462030', '8874885858', '', 'nmalviya575@gmail.com', '', '', '', 'Service', '', '', '', '', '', '', '', '', 0, '', '', '', 0, '', '', 'Cheque', 0, '', '', './uploads/applicants_img/', '2018-03-24', '', '', '', 0, '335', 1, '0.00'),
(258, '2', 'Mr.', 'Anjali Upadyaya', '14-03-1996', 22, '', '', '', 'Bhopal', '', '', '8874885858', '', 'nmalviya575@gmail.com', '', '', '', 'Others', '', '', '', '', '', '', '', '', 0, '', '', '', 0, '', '', 'Cheque', 0, '', '', './uploads/applicants_img/', '2018-03-24', '', '', '', 93, '335', 1, '0.00'),
(259, '2', 'Mr.', 'Pooja Gaur', '18-03-1992', 26, 'S/o', 'Mr.', 'Moolchand', '18 Asainik colony T Ward', '18 Asainik colony T Ward', '462030', '8817448282', '', 'nmalviya575@gmail.com', '', '', '', 'Service', '', '', '', '', '', '', '', '', 0, '', '', '', 0, '', '', 'Cheque', 0, '', '', './uploads/applicants_img/', '2018-03-24', '', '', '', 94, '335', 1, '0.00'),
(260, '2', 'Mr.', 'Avinash Verma', '15-03-1991', 27, '', '', '', 'BHopal', 'BHopal', '', '8817448282', '', 'nmalviya575@gmail.com', '', '', '', 'Service', '', '', '', '', '', '', '', '', 0, '', '', '', 0, '', '', 'Cheque', 0, '', '', './uploads/applicants_img/', '2018-03-24', '', '', '', 96, '335', 1, '0.00'),
